년도	가수	제목	남녀	장르	최고순위	작사가	작곡가	소속사	가사
20180118	선미	주인공	female	댄스	7	선미	24	(주)메이크어스엔터테인먼트	내 몸이 확 머리가 휙 돌아가 어때 지금 기분이 우리는 마치 자석 같아 서로를 안고 또 밀쳐내니까 너는 날 미치게 하고 정신 못 차리게 해 그래 알겠지 넌 참 날 기가 막히게 해 너는 날 춤추게 하고 술 없이 취하게 해 그래 알겠지 넌 참 착한 날 독하게 해 우리 둘만의 이 영화에 진짜 주인공은 너였어 baby 그래 넌 오늘도 너답게 화려한 주인공처럼 그저 하던 대로 해 그게 악역이라도 나를 슬프게 해도 넌 너여야만 해 내가 아플지라도 슬픈 엔딩이라도 the show must go on the show must go on 너는 늘 끝장을 보고 모든 걸 덮으려 해 왜 날개를 달아주고 추락하자 해 너는 늘 착하지 라며 날 눈물 삼키게 하잖아 그래 알겠지 알겠지 넌 날 혹하게 해 우리 둘만의 이 드라마에 진짜 주인공은 너였어 baby 그래 넌 오늘도 너답게 화려한 주인공처럼 그저 하던 대로 해 그게 악역이라도 나를 슬프게 해도 넌 너여야만 해 내가 아플지라도 슬픈 엔딩이라도 the show must go on the show must go on 그저 하던 대로 해 그게 악역이라도 나를 슬프게 해도 넌 너여야만 해 내가 아플지라도 슬픈 엔딩이라도 the show must go on the show must go on you must go on
20180125	iKON	사랑을 했다 (LOVE SCENARIO)	male	랩/힙합	21	못말	승	(주)YG엔터테인먼트	사랑을 했다 우리가 만나 지우지 못할 추억이 됐다 볼만한 멜로드라마 괜찮은 결말 그거면 됐다 널 사랑했다 우리가 만든 LOVE SCENARIO 이젠 조명이 꺼지고 마지막 페이지를 넘기면 조용히 막을 내리죠 에이 괜찮지만은 않아 이별을 마주한다는 건 오늘이었던 우리의 어제에 더는 내일이 없다는 건 아프긴 해도 더 끌었음 상처가 덧나니까 Ye 널 사랑했고 사랑 받았으니 난 이걸로 됐어 나 살아가면서 가끔씩 떠오를 기억 그 안에 네가 있다면 그거면 충분해 사랑을 했다 우리가 만나 지우지 못할 추억이 됐다 볼만한 멜로드라마 괜찮은 결말 그거면 됐다 널 사랑했다 우리가 만든 LOVE SCENARIO 이젠 조명이 꺼지고 마지막 페이지를 넘기면 조용히 막을 내리죠 갈비뼈 사이사이가 찌릿찌릿한 느낌 나 사랑받고 있음을 알게 해주는 눈빛 너에게 참 많이도 배웠다 반쪽을 채웠다 과거로 두기엔 너무 소중한 사람이었다 나 살아가면서 가끔씩 떠오를 기억 그 안에 네가 있다면 그거면 충분해 사랑을 했다 우리가 만나 지우지 못할 추억이 됐다 볼만한 멜로드라마 괜찮은 결말 그거면 됐다 널 사랑했다 네가 벌써 그립지만 그리워하지 않으려 해 한 편의 영화 따스했던 봄으로 너를 기억할게 우리가 만든 LOVE SCENARIO 이젠 조명이 꺼지고 마지막 페이지를 넘기면 조용히 막을 내리죠 우린 아파도 해봤고 우습게 질투도 했어 미친 듯이 사랑했고 우리 이 정도면 됐어 사랑을 했다 우리가 만나 그거면 됐다 널 사랑했다
20180129	수지 (SUZY)	다른사람을 사랑하고 있어	female	발라드	3	아르마딜로	아르마딜로	(주)JYP엔터테인먼트	네가 상처받지 않게 어떻게 말을 꺼낼까 예쁜 말 적당한 핑계로 널 보내고 난 떠나려 했어 일어선 나를 붙잡고 엉엉 울며 매달리기 전 까지 말야 다른 사람을 사랑하고 있어 다 말하고 싶지 않았어 넌 좋은 사람이니까 허물어지는 모래성을 붙잡고 더 애를 쓰려 하지 마 너 아닌 다른 사람을 사랑하고 있어 바란 것도 하나 없이 넌 항상 모든 걸 줬어 행복한 내가 너의 행복이라며 넌 언제나 나만 바라봤어 그런데 너의 사랑이 점점 지쳐 변명 하지 않고 다 말할게 다른 사람을 사랑하고 있어 다 말하고 싶지 않았어 넌 좋은 사람이니까 허물어지는 모래성을 붙잡고 더 애를 쓰려 하지 마 너 아닌 다른 사람을 걱정하다가도 까맣게 널 잊을 만큼 진심으로 사랑하고 있어 아름다웠던 사랑의 끝에서 다 말하고 싶지 않았어 네가 아플까 봐 허물어지는 모래성을 붙잡고 더 애를 쓰려 하지 마 너 아닌 다른 사람을 사랑하고 있어
20180129	Red Velvet (레드벨벳)	Bad Boy	female	댄스	3	문서울	유영진	(주)SM엔터테인먼트	Who dat who dat who dat boy 수많은 사람 속 눈에 띈 무심한 그 표정 I like that 내 호기심을 자극하지 Oh 시크한 스타일은 덤 입은 옷은 신경 쓴 듯 안 쓴 듯 관심 없는 말투 I like that 외면해 봐도 끌려 달라 도도한 날 웃게 하잖아 알잖아 요즘 내가 Hot ah ah 날 보는 시선 너도 느껴봐 홀린 듯 날 따라와 모두 환호해 너도 곧 Ooh ooh Oh eh oh eh oh 아닌 척해도 넌 Ooh ooh Oh eh oh eh oh 한 번 내기를 해볼까 너무 쉽겐 오지 마 재미없잖아 거기서 Ooh ooh Oh eh oh eh oh 밀고 당겨볼까 Ooh ooh Oh eh oh eh oh 시작할게 Bad boy down Whoa whoa 지금부터 Bad boy down Whoa whoa 잠깐 이리 와봐 너에게만 할 말이 있어 가까이 좀 와 고갤 숙여 키를 낮춰봐 다른 건 신경 쓰지 마 내 목소리에 집중해 상황은 좀 달라져 주위를 맴도는 내가 궁금해 너도 알게 될 거야 뭘까 알 거야 말해 이미 늦어버렸단 걸 맞아 사실 꽤나 자신 있어 난 지는 게임 하진 않아 Ha ah ah 벌써 반쯤은 넘어왔잖아 홀린 듯 날 따라와 모두 환호해 너도 곧 Ooh ooh Oh eh oh eh oh 아닌 척해도 넌 Ooh ooh Oh eh oh eh oh 한 번 내기를 해볼까 너무 쉽겐 오지 마 재미없잖아 거기서 Ooh ooh Oh eh oh eh oh 밀고 당겨볼까 Ooh ooh Oh eh oh eh oh 시작할게 Bad boy down 혼란스런 맘이겠지 상상조차 못할 거야 헤어나려 노력해도 어떤 작은 틈도 없어 정답은 정해져 있어 자연스럽게 넌 따라와 난 널 선택해 난 널 선택했어 이미 홀린 듯 날 따라와 모두 환호해 말했지 Ooh ooh Oh eh oh eh oh 결관 항상 같아 Ooh ooh Oh eh oh eh oh 거봐 내가 또 이겼어 너무 쉽겐 오지 마 재미없잖아 이제 넌 Ooh ooh Oh eh oh eh oh 벗어날 수 없어 Ooh ooh Oh eh oh eh oh 내겐 쉽지 Bad boy down
20180205	세븐틴	고맙다	male	댄스	28	호시 (SEVENTEEN)	BUMZU	플레디스 엔터테인먼트	난 그랬던 것 같아 네가 어디 있던지 들릴 때라면 고민도 없이 뛰어 갔었던 그때 그때 어렸던 내 맘은 짓궂은 장난이 다였나 봐 웃는 너를 보는 내 기분이 뭔지 배운 적 없어서 표현을 못 했어 내 맘이 서툴러서 너의 내일이 되고 싶어서 오늘을 살아왔어 너를 처음 본 날 그때부터 지금까지 내 맘속에는 너만 있어 뻔하디뻔한 이 말을 내가 이제서야 꺼내 보지만 뻔하디뻔한 이 말이 전해는 질까요 Yeh 고맙다 고맙다 또 고맙다 뿐이지만 기다림까지 그리움까지 우리 추억까지 고맙다 Yeh 고맙다 Yeh 너무 흔한 말이라 내 마음이 담길까 걱정돼서 하지 못했던 말 고맙다는 말보다 예쁜 말을 찾다가 고맙다고 하지 못했던 나 표현을 못 했어 용기가 부족해서 사랑이란 말을 조금이라도 일찍 알았다면 너를 처음 본 날 그때부터 지금까지 내 맘속에는 너만 있어 뻔하디뻔한 이 말을 내가 이제서야 꺼내 보지만 뻔하디뻔한 이 말이 전해는 질까요 Yeh 고맙다 고맙다 또 고맙다 뿐이지만 기다림까지 사랑이 뭔지 알려준 너에게 고맙다 Yeh 고맙다 Yeh 내 맘 변하지 않아 절대 변하지 않아 네가 나를 지운다 해도 우린 변하지 않아 서로에 맘에 새겨져 있으니까 새겨져 있으니까 고맙다 Yeh 고맙다 Yeh 너에게 너에게 전해졌음 해 이 노래가 고맙다 고맙다
20180307	마마무 (Mamamoo)	별이 빛나는 밤	female	댄스	3	문별 (마마무)	박우상	(주)RBW	손끝이 시리더니 벌써 봄이 왔네 꿈같은 바람이 불어 곳곳에 여느 때 와는 다른 듯한 이 기분이 반가워 내일은 좀 다른 날이 되려나 어둠의 그림자 깊은 이 밤에 남겨진 달이 달이 밝아와 빛을 그리고 있어 내 몸에서 널 뺀 만큼 욕조에 물이 미련이 되어 넘쳐흘러 한숨이 가득 그 공간을 채워 새벽이 찾아오면 혼자 남겨질 때면 Starry night 별이 빛나는 밤 네가 휘휘휘 불어와 너와 나 나눈 수많은 밤 나를 취하게 만들어 별이 빛나는 밤 야야야야이야 별이 빛나는 밤 야야야야야야야 별이 빛나는 밤 겨울이 지나고 또다시 꽃은 피고 따뜻한 공기 냄새가 날 감싸 달라진 거 없는 똑같은 일상이 반복돼 그래도 내일을 기다려봐 하루에 끝에서 이 자리에 남아서 날이 날이 새도록 너를 그리고 있어 Do you want me to leave No 난 그 자리 그대로 까만 밤하늘에 가려 잠시 보이지 않는 거야 새벽이 찾아오면 혼자 남겨질 때면 Starry night 별이 빛나는 밤 네가 휘휘휘 불어와 너와 나 나눈 수많은 밤 나를 취하게 만들어 별이 빛나는 밤 야야야야이야 별이 빛나는 밤 야야야야야야야 별이 빛나는 밤 Starry Starry Night 네가 없는 밤 가슴이 공허해 우리의 풍경이 저물어가 현실을 부정해 눈을 감아도 네가 보여 왜 아른거려 Leave me alone 무너져 가네 Starry night 별이 빛나는 밤 네가 휘휘휘 불어와 너와 나 나눈 수많은 밤 나를 취하게 만들어 별이 빛나는 밤 야야야야이야 별이 빛나는 밤 야야야야야야야 별이 빛나는 밤
20180308	헤이즈 (Heize)	Jenga (Feat. Gaeko)	female	랩/힙합	5	개코	다비 (DAVII)	"Stone Music Entertainment, Studio blu"	i just wanted to play this game 사랑이란 감정에 매료돼 날 가득 채웠네 누가 시킨 적도 없는데 탑을 쌓아 올렸네 난 너의 조각들로 빼곡해 내 맘을 채운 너의 눈 코 입과 너의 특유의 말투와 억양 시야에서 흐릿해져 갈 때면 휘청거리네 나의 하루가 내 맘에 수많은 구멍이 나도 버틸 수 있는 이윤 너라고 이제 네가 한 발짝만 더 발을 빼면 난 무너질 텐데 I don't wanna play this game no more somebody help I don't wanna play this game no more somebody help 탑이 무너지고 나면 폐허가 돼버릴까 봐 펜스를 두르고 유적지로 두면 어떨까 일어나지도 않은 일을 상상하며 이음새를 붙들고 있는 나를 너는 전처럼 바라보지 않아 우리 사랑을 피사의 사탑이라 생각지 않잖아 이 게임의 끝을 준비하게 해줘 쓰러질 땐 아무도 없게 구경거리 되지 않게 내 맘을 채운 너의 눈 코 입과 너의 특유의 말투와 억양 시야에서 흐릿해져 갈 때면 휘청거리네 나의 하루가 내 맘에 수많은 구멍이 나도 버틸 수 있는 이윤 너라고 이제 네가 한 발짝만 더 발을 빼면 난 무너질 텐데 I don't wanna play this game no more somebody help I don't wanna play this game no more somebody help 바람이 불어와 더 이상 못 버틸 것 같아 다시 채워주면 안 될까 내 맘은 굳어가 의미를 잃은 것 같아 I don't wanna play this game no more somebody help I don't wanna play this game no more somebody help
20180308	헤이즈 (Heize)	내가 더 나빠	female	R&B/Soul	12	헤이즈 (Heize)	다비 (DAVII)	"Stone Music Entertainment, Studio blu"	그리워하면서도 미워했어 널 결국에 난 엄마 앞에서까지도 눈물을 보이고 맘 아프게 하고 그게 불효지 뭐 대체 넌 왜 나라는 사람의 살 만 하던 삶에 들어와 불행하게 만들어 버린 건지 난 묻고 싶고 그 대답을 꼭 듣고 싶다고 못 된 나의 원망뿐이던 문자에 몰래 아파야 했던 네 맘을 이제야 알 것 같아 내가 더 나빠 더 나빠 너보다 나빠 더 나빠 네가 더 아파 더 아팠을걸 이제 와 난 알아 그런 널 알면서 네가 내 곁을 떠나갔단 이유로 널 아프게 했어 나는 너에게 사랑과 웃음만을 줬던 것 같은데 이런 아픔 나는 원하지 않는데 너는 왜 나에게 주고 떠난 건데 매일 되뇌어 나쁜 놈이야 넌 나 없이 너는 괜찮은 거냔 그 말에 눈물은 왜 흘린 건지 묻고 싶어 떠나고 싶지 않아 보였다고 나 좀 안아달라고 억지 부리고 붙잡고 울던 날 보던 네 맘은 어땠을까 내가 더 나빠 더 나빠 너보다 나빠 더 나빠 네가 더 아파 더 아팠을걸 이제 와 난 알아 그런 널 알면서 네가 내 곁을 떠나갔단 이유로 널 아프게 했어 워우 워우 워우 내 미래를 위해서라 했던 그 말을 이제 다 이해했고 너가 없는 지옥 같던 그 시간들 이렇게 잘 견뎌냈으니 나 잘 했다고 이제 나를 안아주면 다시 와 주면 안 될까 내가 더 나빠 더 나빠 너보다 나빠 더 나빠 네가 더 아파 더 아팠을걸 이제 와 난 알아 그런 널 알면서 네가 내 곁을 떠나갔단 이유로 널 아프게 했어
20180308	헤이즈 (Heize)	괜찮냐고	female	R&B/Soul	20	헤이즈 (Heize)	다비 (DAVII)	"Stone Music Entertainment, Studio blu"	그래 무슨 말인지 다 알겠어 굳이 계속 강조하지 않아도 잘 알아들었다고 이성적으로 생각하자던 너의 그 말도 애써 이해하는 척했지만 솔직히 답답했어 대체 어떻게 우리 이별이 내 미래의 어떤 부분을 위해서인지 잘 모르겠어 원하는 대로 해 어차피 이젠 너의 마음을 돌리려 해도 너는 정했잖아 답을 어설픈 차가운 말투 내 두 눈도 똑바로 못 보네 연기라도 제대로 해 나 강요하지 않을게 오늘 네가 생각해 온 대로 해 근데 난 대답을 듣고 싶어 넌 괜찮냐고 나 없이 살 수 있냐고 날 보고 싶어도 못 볼 텐데 날 안고 싶어도 못 안을 텐데 내 목소릴 듣고 싶어도 참는 게 괜찮냐고 넌 왜 아무런 말도 못 해 네가 우리에 대해 뭘 안다고 도대체 무슨 자격으로 우린 더 이상 어울리지 않는 둘이라고 단정 짓냐고 이미 네가 정해놓은 이별에 핑계만 달아 내겐 선택권이 없는데 왜 이유가 나야 날 위해서라고 다 날 위해서라고 말하면서 너의 눈은 날 피하고 있잖아 너도 알다시피 내가 좀 독해서 잘 살아갈 수 있을 것 같긴 해 너 없는 세상도 금방 적응해서 난 버텨낼 수 있을 것 같은데 넌 아니잖아 넌 버텨내지 못 해 내가 아는 넌 절대 못 해 근데 난 대답을 듣고 싶어 넌 괜찮냐고 나 없이 살 수 있냐고 날 보고 싶어도 못 볼 텐데 날 안고 싶어도 못 안을 텐데 내 목소릴 듣고 싶어도 참는게 괜찮냐고 내 미래의 모든 곳엔 너 없는 곳이 없는데 날 위해서라니 어떻게 제발 다시 생각해 그래 난 대답을 듣고 싶어 안 괜찮다고 나 없이 살 수 없다고 날 보고싶어 죽을 것 같다고 날 안고싶어 미칠 것 같다고 내 목소릴 듣고 싶어도 참는게 힘들다고
20180313	BIGBANG	꽃 길	male	R&B/Soul	1	T.O.P	The Fliptones	(주)YG엔터테인먼트	그땐 참 좋았는데 말이야 너와 함께할 수만 있다면 때론 외롭고 슬퍼도 말이야 너와 같이 할 수만 있다면 Sing it na na na 노래해 나나나 우리 이게 마지막이 아니야 부디 또 만나요 꽃이 피면 때론 꽤 별난 일이 많아 넌 나 같이 못난 놈을 만나 다시 누군갈 사랑할 수 있을까 너 아니라면 그럴 일은 없을 것 같아 나 의식 없이 발길 흐름대로 가던 길 날 화려히 비춰주던 네 빛 한줄기 그 전율이 느껴지는 예쁜 꽃 길 그곳에 너로 인해 설수 있던 Roly poly toy 떠나려거든 보내 드리오리다 님이 가시는 길에 꽃을 뿌리오리다 그리워지면 돌아와 줘요 그때 또 다시 날 사랑해줘요 이 꽃 길 따라 잠시 쉬어가다가 그 자리 그곳에서 날 기다려요 그땐 참 좋았는데 말이야 너와 함께할 수만 있다면 때론 외롭고 슬퍼도 말이야 너와 같이 할 수만 있다면 많이 울기도 했지만 웃은 일도 많아 내 머릿속 안에는 추억이 너무 많아 이 또한 지나갈 테니까 이 다음에 만나요 꽃이 피면 1년 365 이 세상 하나뿐인 넌 내 음악의 Motive 날 일깨워주는 은인 네 커다란 꽃밭에 기대어 막 떠오르던 가사말 아직도 참 생생해 빠담빠담 너란 만개 한 꽃의 색은 100000 개 무한대 거대한 울림 Vivaldi의 사계 아직도 그댄 내 맘에 담을 수 없는 그림 내 눈을 의심하지 You are my Magical Queen 떠나려거든 보내 드리오리다 님이 가시는 길에 꽃을 뿌리오리다 그리워지면 돌아와 줘요 그때 또 다시 날 사랑해줘요 이 꽃 길 따라 잠시 쉬어가다가 그 자리 그곳에서 날 기다려요 꽃 잎 따다 입을 맞추죠 얼굴은 빨개지고 꽃 길을 깔아 준비를 하죠 그대가 오시는 길 그리워지면 돌아와 줘요 그때 또 다시 날 사랑해줘요 이 꽃 길 따라 잠시 쉬어가다가 그 자리 그곳에서 날 기다려요 꽃 잎 따다 입을 맞추죠 얼굴은 빨개지고 꽃 길을 깔아 준비를 하죠 그 자리 그곳에서 날 기다려요
20180319	Wanna One (워너원)	약속해요 (I.P.U.)	male	댄스	8	별들의 전쟁 (GALACTIKA *)	로빈	YMC엔터테인먼트	벚꽃이 떨어지던 날 그댈 처음 만났죠 낯설은 떨림과 두려운 설렘들이 뒤섞이던 날 이제서야 말해요 나 많이 겁이 났었죠 어쩌면 그때가 마지막이라고 생각했었기에 서툰 날 가슴에 품어주었던 못난 날 기꺼이 안아주었던 그대 눈빛을 아직도 기억해요 나 왼쪽 가슴에 새길게요 영원히 약속해요 잊지 않겠다고 날 다시 태어나게 해준 널 I promise you I promise you 내가 더 많이 더 잘할게요 약속해요 놓지 않겠다고 내게 빛이 되어준 그댈 I promise you I promise you 빛나던 봄날 앞에 약속해요 단 하나라도 내 편이 되어주길 바랐던 그때 세상이 날 속여도 너만은 날 믿어줬었지 피지 못한 꽃처럼 시들 수도 있던 날 알아봐 줬던 너니까 흔들리던 날 잡아준 너니까 Oh 새삼스레 하루하루가 너무나 소중해 선물 같은 나날 매일매일이 기념일 같아 태양에 안겨버린 달처럼 너무 예쁘게 어떤 빛보다 더 반짝여 영원히 약속해요 잊지 않겠다고 날 다시 태어나게 해준 널 I promise you I promise you 빛나던 봄날 앞에 약속해요 몇 번의 계절이 스치고 시간이 우리를 지나가도 처음의 우리를 잊지 말아요 I promise you baby 기억해요 나조차도 몰랐던 나를 알아봐 줬던 그대가 있어 지금의 내가 있단 걸 걱정 마 I remember 영원히 I remember Forever and ever I promise you 약속해요 변치 않겠다고 지금 이대로 삶의 끝까지 I promise you I promise you 빛나던 봄날 앞에 I promise you Uh Oh Oh Oh Oh Uh Oh Oh Oh Oh I promise you Uh Oh Oh Oh Oh Uh Oh Oh Oh Oh 그대 앞에 나 약속해요
20180319	Wanna One (워너원)	BOOMERANG (부메랑)	male	댄스	9	Shaun Kim	Shaun Kim	YMC엔터테인먼트	Wing Wing Wing Wing BOOMERANG Hey 돌아버려 Boom Boom Boom Boom 네 마음 향해 슛 하고 던졌는데 Oh my god 화살은 내게 퓨 하고 다시 날아와 날 괴롭히네 No No No No 정체가 대체 뭔데 What 나를 미치게 해 나를 미치게 해 나도 나름 괜찮은데 Hey 어떻게 너는 나를 작아지게 하는 건지 I don't know Know Oh 네 얼굴 행동 하나하나 다 Love it No No No No No No No No No No 나를 봐 나만 봐 내 옆에만 꼭 붙어 있어줘 Oh 그대여 가지 마세요 Wing Wing Wing Wing BOOMERANG Hey 돌아버려 내가 도는 건지 날린 건지 Hey 돌아버려 Boom Boom Boom Boom BOOMERANG 너에게 나 달려가 Oh Baby 내 품에 와줘 솔직하게 말할게 나 같은 남잔 없어 Never let you go 너만 보는 바보 Oh what 주위에서 놀려대 상관이 없어 다 뭐라 하던 너만 내게 있으면 돼 All I wanna do Oh 네 얼굴 행동 하나하나 다 Love it No No No No No No No No No No 나를 봐 나만 봐 내 옆에만 꼭 붙어 있어줘 Oh 그대여 가지 마세요 Wing Wing Wing Wing BOOMERANG Hey 날려버려 네게 빠진 건지 홀린 건지 Hey 날려버려 Boom Boom Boom Boom BOOMERANG Baby 넌 날 알까 Don’t you know 얼마나 내가 원하는지 I promise you 난 너뿐 약속해 어디든 Take you there 그 누가 뭐라든 I don’t care 네 손에 반지를 끼워 줄 수 있게 Wing Wing Wing Wing BOOMERANG Uh Oh Hey 돌아버려 내가 도는 건지 날린 건지 Hey 돌아버려 Boom Boom Boom Boom BOOMERANG
20180320	폴킴	"모든 날, 모든 순간 (Every day, Every Moment)"	male	"발라드, 국내드라마"	4	어깨깡패	어깨깡패	뉴런뮤직	네가 없이 웃을 수 있을까 생각만 해도 눈물이나 힘든 시간 날 지켜준 사람 이제는 내가 그댈 지킬 테니 너의 품은 항상 따뜻했어 고단했던 나의 하루에 유일한 휴식처 나는 너 하나로 충분해 긴 말 안 해도 눈빛으로 다 아니깐 한 송이의 꽃이 피고 지는 모든 날 모든 순간 함께해 햇살처럼 빛나고 있었지 나를 보는 네 눈빛은 꿈이라고 해도 좋을 만큼 그 모든 순간은 눈부셨다 불안했던 나의 고된 삶에 한줄기 빛처럼 다가와 날 웃게 해준 너 나는 너 하나로 충분해 긴 말 안 해도 눈빛으로 다 아니깐 한 송이의 꽃이 피고 지는 모든 날 모든 순간 함께해 알 수 없는 미래지만 네 품속에 있는 지금 순간 순간이 영원 했으면 해 갈게 바람이 좋은 날에 햇살 눈부신 어떤 날에 너에게로 처음 내게 왔던 그날처럼 모든 날 모든 순간 함께해
20180404	WINNER	EVERYDAY	male	랩/힙합	5	이승훈	MINO (송민호)	(주)YG엔터테인먼트	"영화나 볼래 조조 너만 좋다면 난 고고 (고고씽) 대답해 그냥 ㅇㅇ (She says, “Yes”) 티켓 두 장은 로또 너 화장하지 마, 배불러 더 이뻐지면 난 앰뷸런스 Honeybee, honeybee 꼬여 꽃을 쥔 건 Only one That's you, you woo wee 넌 나의 종교, 일주일 매일 영접할 수 있다면 매일이 주일 Woo wee  도대체 넌 뭔데 빈틈이 없네 잘 웃다가도 토라지면 마음이 아파와 I want you to love me, oh till I die yeah 다 가져가 원한다면 내 모든 오늘을, Babe  넌 봐도, 봐도 끝이 안 보여 넌 파도, 파도 매일 새로워 월 화 수 목 금 토 일 가지곤 부족해 하루를 더 만들 지경  Everyday, day, every, everyday (With u, with u, with u) Everyday, day, every, everyday (With me, with me, with me) Everyday, day, every, everyday (일 주, 일 주, 일주일) Everyday, day, every, everyday (Everyday, yeah)   피자, 파스타는 So so (yum, yum) 네가 원함 난 ㄱㄱ (고고씽) 수업 마치고 톡톡 (톡톡) 만나면 반갑다고 뽀뽀 (chu) 미소 한방에 정신이 픽픽픽 전화긴 계속 링링링 여사친 이젠 다 ㅂㅂㅂ 정리하고 네게 올인인인 Everyday 기도해 365일 내 이름 대신 불러줘, My boy 주머니에 찔러 넣은 손 꺼내서 내 손잡아 줘  도대체 넌 뭔데 빈틈이 없네 잘 웃다가도 토라지면 마음이 아파와 I want you to love me, oh till I die yeah 다 가져가 원한다면 내 모든 오늘을, Babe  넌 봐도, 봐도 끝이 안 보여 넌 파도, 파도 매일 새로워 월 화 수 목 금 토 일 가지곤 부족해 하루를 더 만들 지경  Everyday, day, every, everyday (With u, with u, with u) Everyday, day, every, everyday (With me, with me, with me) Everyday, day, every, everyday (일 주, 일 주, 일주일) Everyday, day, every, everyday  잠이 뭐가 필요해 네가 필요해 난 너와의 시간이 다 약이라서 하나도 안 피곤해 아니 부족해 더 가까이 이리 와 널 원해, 원해, 원해, 더  Everyday, day, every, everyday (With u, with u, with u) Everyday, day, every, everyday (With me, with me, with me) Everyday, day, every, everyday (일 주, 일 주, 일주일) Everyday, day, every, everyday (Everyday, yeah)"
