년도	가수	제목	남녀	장르	최고순위	작사가	작곡가	소속사	가사
20160106	케이윌	니가 하면 로맨스 (Feat. 다비치)	male	R&B/Soul	3	라이머	원영헌	스타쉽 엔터테인먼트	혼자였던 너를 사랑한 많은 사람 중 내가 널 갖게 돼서 행복했어 애매한 두 사랑 아닌 한 사랑이 되고 이젠 다 내꺼라고 믿었는데 RING RING RING RING 여전히 바쁜 니 폰 오늘도 불이 나 아직도 넌 그 사람과 질질질질 끌면서 그저 그런 연락일 뿐이래 말 같지도 않아 그 사람과 사랑 아닌 척 사랑하는 널 사랑하는 난 니 바보 난 니 바보 난 니 바보 인가봐 이런 게 어딨어 이런 게 어딨어 하지만 눈감아줄게 잠시만 니가 하면 로맨스 로맨스 니가 하면 로맨스 로맨스 니가 나의 로맨스 로맨스 오래 상처주진 말아줘 부탁해 혼자였던 나를 사랑에 눈 뜨게 만든 니가 날 선택해서 고마웠어 그래서 솔직히 많은 건 바라지 않아 단지 니 옆이면 충분했는데 RING RING RING RING 밤낮도 없는 니 폰 내속은 불이 나 참아야지 하면서도 빙빙빙빙 맴돌며 그저 그런 친구일 뿐이래 말 같지도 않아 그 사람과 사랑 아닌 척 사랑하는 널 사랑하는 난 니 바보 난 니 바보 난 니 바보 인가봐 이런 게 어딨어 이런 게 어딨어 하지만 눈감아줄게 잠시만 니가 하면 로맨스 로맨스 니가 하면 로맨스 로맨스 니가 나의 로맨스 로맨스 오래 상처주진 말아줘 부탁해 너의 문젠 너의 문젠 둘 빼기 하난데 이게 뭐야 답이 뭐야 왜 아직도 둘이 남았지 미운 만큼 니가 좋아 좋은 만큼 니가 밉다 내가 바보 같지만 사랑 하니까 너를 기다려 줄게 그 사람과 사랑 아닌 척 사랑하는 널 사랑하는 날 왜 바보 날 왜 바보 날 왜 바보 만들어 이러지 말아줘 이러지 말아줘 더 이상 날 애타게 만들지마 니가 하면 로맨스 로맨스 니가 하면 로맨스 로맨스 니가 나의 로맨스 로맨스 오래 상처주진 말아줘 부탁해 널 모두 부탁해 내게 줘 부탁해 니 전부를 이제 완벽하게 내게 와줘
20160107	수지 (SUZY)	Dream (Prod. by 박근태)	female	R&B/Soul	4	김이나	진바이진	(주)JYP엔터테인먼트	예쁘네 오늘도 어제만큼 아니 오늘은 더 예뻐졌네 이런 말을 할 때마다 너는 못 들은 척 늘 딴 얘기를 해 어젠 너무 좋은 꿈을 꿨어 지금 말해주긴 간지러워서 말하기 싫어 그리고 이런 건 말하면 안 된대 dream 다신 꾸지 못하는 너무 기분 좋은 꿈 나는 니가 꼭 그런 거 같은데 dream 종일 아른거리는 너무 기분 좋은 꿈 그게 바로 너 우리 둘 너무 잘 어울린대 I know she knows 사실 내가 봐도 그래 근데 가끔 불안한 기분이 들 땐 혼자서 울적해 hmm 거짓말 그렇게 자신 있는 얼굴을 하고 있으면서 하지만 듣기엔 참 좋다 그렇긴 하네 dream 다신 꾸지 못하는 너무 기분 좋은 꿈 나는 니가 꼭 그런 거 같은데 dream 종일 아른거리는 너무 기분 좋은 꿈 그게 바로 너 well I don’t care even if you’re a sweet liar well I don’t care cause I will make you believe dream 지금 그런 눈으로 나를 바라볼 때면 나는 니가 꼭 내 것 같은데 dream 다시 잠들고 싶은 너무 기분 좋은 꿈 그게 바로 너
20160122	Crush	잊어버리지마 (Feat. 태연)	male	R&B/Soul	6	Zion.T	Zion.T	피네이션	너와 나 언젠가 남이 되어도 영영 닿을 수 없는 사이 되어도 잊어버리지마 잃어버리지마 혹시나 다른 사람의 손 잡고 있어도 영영 닿을 수 없는 곳에 있어도 잊어버리지마 잃어버리지마 따뜻해 볼이 맞닿을 때 살며시 시린 내 손 잡아줄 때 차가운 세상에 지친 내 맘을 온기로 감싸네 예에이에 내 눈에 담긴 너의 얼굴 내 품에 잠든 너의 모습 이대로 멈췄으면 해 꽉 잡은 두 손 놓치면 안돼 너와 나 언젠가 남이 되어도 영영 닿을 수 없는 사이 되어도 잊어버리지마 잃어버리지마 혹시나 다른 사람의 손 잡고 있어도 영영 닿을 수 없는 곳에 있어도 잊어버리지마 잃어버리지마 마주 앉아 널 바라보는 지금이 영원하길 바래 혹시나 시간이 우릴 질투 할까 봐 사실 걱정 돼 변치 마 always by my side 영원히 함께 my love 언젠가 날 기억해주길 한번쯤은 뒤 돌아보길 부디 놓지 말아줘 우릴 계속 바라봐주길 Oh My love 시간이 지나 baby 너와 나 우리가 남이 되어도 잊어버리지마 날 잊어버리지마 랄라 랄라랄라 랄라 이 노랠 잊어버리지마
20160125	지코 (ZICO)	너는 나 나는 너	male	R&B/Soul	1	지코 (ZICO)	PEEJAY	KOZ 엔터테인먼트	넌 나고 난 너야 난 너고 넌 나야 마음이 같다면 둘은 서로가 될 거야 넌 나고 난 너야 그림 너무 좋아 오그라든다는 말은 누가 만든 걸까 girl 뺨 한 대만 때려줘 며칠 사이 내게 무슨 일이 벌어진 건지 전 여친 번호 지우고 힙합만 듣던 난 어쿠스틱해졌어 tell me what you want from me 가장 예쁠 나이엔 실컷 사랑해봐야 돼 eh 네 사연 속에 나오는 쓰레기 걔랑은 비교도 안되게 내가 잘할게 왜냐면 넌 나고 난 너야 난 너고 넌 나야 마음이 같다면 둘은 서로가 될 거야 넌 나고 난 너야 그림 너무 좋아 오그라든다는 말은 누가 만든 걸까 친구들이 말해 좋을 때야 난 딱히 걱정 없고 하도 좋아서 문제야 이거 봐 욕도 줄이고 있고 바지도 올려 입고 아무한테나 미소 안 보이고 있어 거울 그만 봐 고칠 데가 어디 있어 민낯일 때 제일 이뻐 이 장면 우리 엄마 보면 기절할 노릇일 걸 더 이상의 표현은 아낄게 사실 너 이름만 옮겨 적으면 그만인데 I believe in destiny 사주나 타로 카드에 점쳐질 만남은 안 해 yeah 집착 쩌는 네 전 남친이 집 근처도 얼씬 못하게 내가 잘할게 왜냐면 Because 넌 나고 난 너야 난 너고 넌 나야 마음이 같다면 둘은 서로가 될 거야 넌 나고 난 너야 그림 너무 좋아 오그라든다는 말은 누가 만든 걸까 밤새 쪽쪽 거리다가 누추한 모습으로 함께 아침을 맞아 good morning 새삼스럽게 넌 심각하게 예뻐 그 입 당장 가져와 Mwah 넌 나고 난 너야 난 너고 넌 나야 마음이 같다면 둘은 서로가 될 거야 넌 나고 난 너야 그림 너무 좋아 오그라든다는 말은 누가 만든 걸까 Let me talk to you yeah I am you you are me I am you you are me
20160125	여자친구 (GFRIEND)	시간을 달려서 (Rough)	female	댄스	3	용배 (RBW)	용배 (RBW)	(주)쏘스뮤직	다가서지 못하고 헤매이고 있어 좋아하지만 다른 곳을 보고 있어 가까워 지려고 하면 할수록 멀어져 가는 우리 둘의 마음처럼 만나지 못해 맴돌고 있어 우린 마치 평행선처럼 말도 안돼 우린 반드시 만날 거야 기다릴게 언제까지나 미처 말하지 못했어 다만 너를 좋아했어 어린 날의 꿈처럼 마치 기적처럼 시간을 달려서 어른이 될 수만 있다면 거친 세상 속에서 손을 잡아줄게 다가서려 해봐도 엇갈리고 있어 좋아한단 말도 아직 못하고 있어 머뭇거리는 널 보고 있으면 우린 아직도 많이 어리긴 한가 봐 좁혀지지 않아 한 끗 차이 우린 마치 평행선처럼 언젠가는 못다한 말을 전할 거야 다가갈게 언제까지나 미처 말하지 못했어 다만 너를 좋아했어 어린 날의 꿈처럼 마치 기적처럼 시간을 달려서 어른이 될 수만 있다면 거친 세상 속에서 손을 잡아줄게 시간 속에 갇혀 길을 헤매여도 그렇지만 우린 결국 만날 거야 진심인 것만 알아줘 정말 서툴기만 한대도 미처 말하지 못했어 다만 너를 좋아했어 어린 날의 꿈처럼 마치 기적처럼 시간을 달려서 어른이 될 수만 있다면 거친 세상 속에서 너를 안아줄게 이거 하나만 약속해 변치 않기를 바랄게 그때도 지금처럼 날 향해 웃어줘 시간이 흘러서 어른이 될 수만 있다면 엇갈림 그 속에서 손을 잡아줄게
20160125	지코 (ZICO)	사랑이었다 (Feat. 루나 of f(x))	male	발라드	8	지코 (ZICO)	Poptime	KOZ 엔터테인먼트	알 수 없다 눈 뜨고 꿈꾸는 기분일까 괜히 가슴이 소란스러워지고 그리움도 경험해본다 내게 짓던 웃음이 참 예뻤지만 네 맘은 항상 표정을 짓지 않아 상처 난 것들을 보여주면서 치유받길 거절하는 널 보며 내가 할 게 못 되는구나 힘들다 시간 지나면 다 없었던 일 잠시 미쳤다 생각했는데 사랑이었다 사랑이었다 이제 와 보니 사랑한 거였다 나답지 않던 말과 행동이 멋대로 굴고 있는 심장이 사랑이었다 사랑이었다 나보다 소중한 게 있었다 언제쯤 넌 내 이름 불러줄까 널 꺾는다고 그 향기가 내 게 될까 넌 쓸쓸함에 대해 얘기하면서 안아주려는 내 손을 밀쳤어 체념할 자격도 없는 나 괴롭다 시간 지나면 다 없었던 일 잠시 미쳤다 생각했는데 사랑이었다 사랑이었다 이제 와 보니 사랑한 거였다 나답지 않던 말과 행동이 멋대로 굴고 있는 심장이 사랑이었다 사랑이었다 나보다 소중한 게 있었다 이제 더 이상은 특별함을 찾지 않아 널 쫓느라 두고 간 원래의 나를 찾아 혼자 한 사랑은 스스로 이별해야 되네 시간 지나면 다 없었던 일 잠시 미쳤다 생각했는데 사랑이었다 사랑이었다 이제 와 보니 사랑한 거였다 나답지 않던 말과 행동이 멋대로 굴고 있는 심장이 사랑이었다 사랑이었다 나보다 소중한 게 있었다 나보다 소중한 게 있었다
20160129	마마무 (Mamamoo)	I Miss You	female	R&B/Soul	19	문별 (마마무)	김도훈 (RBW)	(주)RBW	I Miss You  저녁 노을 하늘을 바라보면 So much I miss you 바람이 좋은 이런 날이면 난 너너너너너 좋은 노래 소리가 들리면 So much I miss you 좋은 영활 볼 때면 또 생각나 난 너너너너너 너와 나누던 나의 하루는 이젠 없는데 별이 뜨는 밤이면 언제나 So much I miss you 소리 없이 눈물이 흐르면 난 너너너너너 너의 목소리도 So much I miss you 어제도 오늘도 난 너너너너너 나를 어루만지던 그 손길 So much I miss you 내가 보고 싶다고 떼를 쓰던 너너너너너 너와 나누던 나의 하루는 이젠 없는데 별이 뜨는 밤이면 언제나 So much I miss you 소리 없이 눈물이 흐르면 난 너너너너너 너의 목소리도 So much I miss you 어제도 오늘도 난 너너너너너 요즘 너 대신 안고 자는 티슈 폰 재생목록에 슬픈 노래만이 가득 찬 이유 이 노래처럼 내 맘을 위로해 줄 것 만 같아 But I miss you 방안 곳곳 남겨진 니 흔적 온통 눈물로 번져 누구나 하는 이별 왜이리 유별나게 구는 건지 오늘따라 유난스러 너의 속삭임 너의 손길은 이젠 없는데 오 난 너뿐인데 난 니가 그리워 별이 뜨는 밤이면 언제나 So much I miss you 소리 없이 눈물이 흐르면 난 너너너너너 너의 목소리도 So much I miss you 어제도 오늘도 난 너너너너너 별이 뜨는 밤이면 언제나 So much I miss you 소리 없이 눈물이 흐르면 난 너너너너너 Whenever Wherever So much I miss you Whenever Wherever I miss you So much 난 너너너너너 No No No So much I miss you 난 너너너너너
20160201	WINNER	센치해	male	댄스	11	이승훈	강욱진	(주)YG엔터테인먼트	밤이 되면 어김없이 찾아오는 이 느낌이 왠지 원망스러워 괜히 또 전화 걸어 봐 너도 나와 같은 마음일까 봐 나 지금 센치해 천장만 바라봐 아무것도 없는 바탕에 그림 그려봤자 나 조금 센치해 좁은 내 방 한 칸 오늘따라 너무 넓어 혼자 누워있기엔 Bed time story 불러줘 자장가 잠들고 싶어도 양들이 멀리 도망가 창문 부딪히는 소리가 천둥인 듯이 무서워 오늘 밤 종이 울려 밤 열두시 달은 내게 인사해도 오늘은 별로 반갑지 않아 머릴 흔들면 어지러워 내 곁에 아무도 없잖아 감정은 low한데 난 우주까지 가고파 이 맘 누가 알아줄까 죽고 싶어 말로만 밤이 되면 어김없이 찾아오는 이 느낌이 왠지 원망스러워 괜히 또 전화 걸어 봐 너도 나와 같은 마음일까 봐 나 지금 센치해 천장만 바라봐 아무것도 없는 바탕에 그림 그려봤자 나 조금 센치해 좁은 내 방 한 칸 오늘따라 너무 넓어 혼자 누워있기엔 그냥 하늘에 떠 있는 별이 되고파 아무것도 안 해도 스스로 빛을 내잖아 어두워진 밤과 같이 어두워진 마음 외로워 위태로워 누가 날 알아줄까 괜히 어울리지 않는 재즈 음악을 틀어요 레이찰스같이 비가 나를 적시듯 음악 소린 울려 퍼져 귀에서 발끝까지 조심해 조심해 SNS 감성에 취해 헛소리 적지 않기 혈기 왕성한 마음에 전 여자친구한테 전화 않기 밤이 되면 어김없이 찾아오는 이 느낌이 왠지 원망스러워 괜히 또 전화 걸어 봐 너도 나와 같은 마음일까 봐 나 지금 센치해 천장만 바라봐 아무것도 없는 바탕에 그림 그려봤자 나 조금 센치해 좁은 내 방 한 칸 오늘따라 너무 넓어 혼자 누워있기엔 잡히지 않아 이제 와 후회해도 눈에 보이지 않아 아무리 애를 써도 우리는 영원히 행복할 순 없겠지 나 지금 센치해 천장만 바라봐 아무것도 없는 바탕에 그림 그려봤자 나 조금 센치해 좁은 내 방 한 칸 오늘따라 너무 넓어 혼자 누워있기엔 밤이 되면 어김없이 찾아오는 이 느낌이 왠지 원망스러워
20160201	WINNER	BABY BABY	male	발라드	12	이승훈	남태현	(주)YG엔터테인먼트	Baby baby 이 밤이 싫어요 Baby baby 혼자가 싫어요 Hey girls 안 바쁘면 오늘 밤은 나와 함께 있어줄래 Oh baby 별거 안 바래 그냥 말동무 좀 해줘요 My friends 오늘 뭐 하니 우리 술 한잔 기울일까 너 바쁘구나 그렇다면 다음에 얼굴이나 한번 보자 Baby baby 이 밤이 싫어요 Baby baby 혼자가 싫어요 우리 함께 외로운 이 밤을 지새워요 모든걸 잊고 다같이 취해가요 Baby baby 혼자가 싫어요 침대 위에 표류해 쓰는 SOS 뭐해 라고 보낸 톡방은 셀수없네 웅크리고 앉어 한없이 작아져 세상의 소음보다 정적이 더 시끄러워 shut up 거리엔 여자들이 비처럼 쏟아지듯 내려와 근데 맞을 일이 없어 머리 위 우산 좀 내려놔 새벽은 너무 길고 시처럼 너의 답은 짧어 해가 뜨면 다시 또 그렇게 잠이 들고 말 걸 Baby baby 이 밤이 싫어요 Baby baby 혼자가 싫어요 우리 함께 외로운 이 밤을 지새워요 모든걸 잊고 다같이 취해가요 Baby baby 혼자가 싫어요 시간이 지나면 지나갈수록 사랑을 향한 그리움만 커져서 난 아무것도 못하죠 날 좀 제발 살려줘요 Baby baby 이 밤이 싫어요 Baby baby 혼자가 싫어요 우리 함께 외로운 이 밤을 지새워요 모든걸 잊고 다같이 취해가요 Baby baby 혼자가 싫어요 Baby baby 이 밤이 싫어요 Baby baby 혼자가 싫어요 우리 함께 외로운 이 밤을 지새워요 모든걸 잊고 다같이 취해가요 Baby baby 혼자가 싫어요
20160212	마마무 (Mamamoo)	1cm의 자존심	female	랩/힙합	18	화사 (Hwa Sa)	김도훈 (RBW)	(주)RBW	여기 나보다 큰 사람 있어 없으면 됐어 마마무 마마무 마마무 너 보단 내가 더 커 넌 160 난 1 마마무 마마무 마마무 우리 끼리끼리끼리 딱 1cm 차이 뭔 헛소리 일단 휘인인 먼 나라 얘기 Ok 베프지만 키 앞에선 장사 없지 Small 휘인 어줍자니 일센치 가지고 언니들 이러기 우리 쿨하게 좀 가자 나만 힐 신기 너와 나의 차이 1cm 언닌 두상이 좀 커 그냥 받아들여 난쟁이 그냥 받아들여 달라질 건 없어 인생 뭐라카노 Do you know What I'm saying 아이고 우리 언니가 어디 번데기 앞에서 주름을 잡을까요 이봐요 올라오려면 멀었네 여기 높은 곳까지 거기 아랫 공기는 어때 많이 탁하지 난 거기 못 가 입장불가 고만고만해 그만그만해 이럴 시간 있음 다른 거나 고민해 Oh 우리 휘인이 손이 안 닿니 내가 꺼내줄께 언니가 이 구역에 장신 마마무 마마무 마마무 너 보단 내가 더 커 넌 160 난 1 마마무 마마무 마마무 우리 끼리끼리끼리 딱 1cm 차이 A-YO 반올림해도 작아요 나보다 더 깔창을 깔아봐요 소용없나요 힐을 신어도 티가 나고 운동화를 신어도 티가 나 키 순서가 도레미파 너와 나의 차이 1cm 1.8 누가 봐도 이건 Same Same 둘 다 두상이 좀 커 여긴 우물 안의 전쟁 You know What I’m talking about 거기 문스타 아주 그냥 물 만나셨어 어허 인정해 여유 넘치는 게 장신인척 난리 우월한 척 난리 최홍만 인 척 난리 그래 봤자 도토리 맷돌손잡이가 빠졌어 맷돌손잡이가 빠졌어 지나가는 조태오가 웃어 지금 내 기분이 그래 어이가 없네 마마무 마마무 마마무 너 보단 내가 더 커 넌 160 난 1 마마무 마마무 마마무 우리 끼리끼리끼리 딱 1cm 차이 여기 나보다 큰사람 있어 너 보단 내가 더 커 너 보단 너 보단 내가 더 커 너 보단 내가 더 커 너 보단 너 보단 내가 더 커 너 보단 내가 더 커 너 보단 너 보단 내가 더 커 너 보단 내가 더 커 너 보단 너 보단 너 보단 내가 더 커 잘 들어 난쟁이들아 내가 이 바닥에서 너 보단 내가 더 커 너 보단 너 보단 내가 더 커 너 보단 내가 더 커 너 보단 너 보단 내가 더 커 너 보단 내가 더 커 너 보단 너 보단 내가 더 커 너 보단 내가 더 커 너 보단 너 보단 너 보단 내가 더 커
20160226	마마무 (Mamamoo)	넌 is 뭔들	female	댄스	8	솔라 (마마무)	이단옆차기	(주)RBW	Come on Hey Mommy Come on Hey Daddy 이리와서 얘들 좀 봐 Come on Hey Sister Come on Hey Brother 누가 얘들 좀 말려줘 귀여운 척 섹시한 척 이쁜 척 그런 거 안해도 날 알아보는 너 센스매너 말투표정 행동 하나까지 섬세한 널 알아보는 나 우리 둘 사이 딱 한 뼘 사이 매일 아침 난 너의 목소리로 눈을 뜨고 우리 둘 사이 딱 맞는 타입 Come on 거기 미스터 Come on 이리와 봐 천천히 아주 조금씩 Hey 거기 미소가 예쁜 남자 바로 너 너어어어 아아아아 날 미치게 하는 그런 남자 몸매도 얼굴도 시선강탈 Hey Mr. 생각이 멋진 남자 바로 너 너어어어 아아아아 나 지금 너 땜에 혼란스러 제발 누가 나 좀 말려줘 월화수목금토일 난 매일매일 너를 생각해 넌 나를 생각해 Word up Moon star A형 B형 AB O형 플러스 마이너스 상관없어 S극과 N극처럼 어떤 공식이든 끌려 단지 그냥 너라서 우리 둘 사이 딱 한 뼘 사이 매일 밤마다 너의 자장가로 잠이 들고 우리 둘 사이 딱 맞는 타입 Come on 거기 미스터 Come on 이리와 봐 조용히 속삭여줄래 Hey 거기 미소가 예쁜 남자 바로 너 너어어어 아아아아 날 미치게 하는 그런 남자 몸매도 얼굴도 시선강탈 Hey Mr. 생각이 멋진 남자 바로 너 너어어어 아아아아 나 지금 너 땜에 혼란스러 제발 누가 나 좀 말려줘 I like eye contact 입술을 꽉 깨물어 Your Lips 너의 두 눈이 스칠 때면 Two Eyes 숨막히는 이끌림이 날 어지럽게 해 나 너만의 영원한 소녀 팬 is 뭔들 모든 게 넌 is 뭔들 완벽해 That's right That's right 우리 사이 자꾸 떠오르네 문득 너라면 난 is 뭔들 24시간 1분 1초가 조마조마해 조금이라도 널 놓칠까 봐 24시간 지금 이순간 Come on 나를 봐봐 Come on 넌 is 뭔들 이젠 우릴 말리지마 Hey Hey Hey Yeah Hey 거기 미소가 예쁜 남자 바로 너 너어어어 아아아아 날 미치게 하는 그런 남자 몸매도 얼굴도 시선강탈 Hey Mr. 애매모호 피아노 맨 바로 너 너어어어 아아아아 나 지금 너 땜에 혼란스러 제발 누가 나 좀 말려줘 Come on 넌 is 뭔들
20160226	에디킴	팔당댐 (Feat. 빈지노)	male	댄스	19	빈지노 (Beenzino)	Postino	미스틱89	팔당댐 saturday night 쉴 틈 없는 핸드폰 ringing 답장은 no no 도도하게 물밀듯 밀려오는 girls like 팔당댐 I got the feel 느꼈어 내게 빠져버린 널 봐버렸어 솔직히 난 너무 평범해 it doesn't matter 내겐 죽이는 입담 period woah woah slow it down 끝이 나려면 아직인 토요일 밤이니까 너도 나에게 올인 말길 솔직히 말할게 오늘 너의 outfit은 woah woah 난 좀 별로 그 정도 몸매면은 더욱더 잘 보이게 입으면 좋을 텐데 너무 감춘 것 같아서 솔직히 좀 아쉬워 속물들이 왔다 갔다 DAM how you doin‘ baby 댐 밑 깊은 물속 그녈 찾기 바쁜 팔당댐 saturday night 쉴 틈 없는 핸드폰 ringing 답장은 no no 도도하게 물밀듯 밀려오는 girls like 팔당댐 I said slow it down girl 충분히 알겠어 너가 귀엽다는 건 그런데 오늘은 토요일 밤인 걸 난 솔직히 너가 평소와 다른 걸 보여주길 원해 착한 건 알겠는데 girl what else do you have 난 더 알고픈 게 확실히 있어 please be bad girl I've got the feel 느꼈어 얘 또 빠져버린 걸 알아채 버렸어 but I ain't got no feel about you no freakin’ special ‘bout you it doesn't matter 속물들이 왔다 갔다 DAM how you doin' baby 댐 밑 깊은 물속 그녈 찾기 바쁜 tonight in the dam in the dam saturday night 쉴 틈 없는 핸드폰 ringing 답장은 no no 도도하게 물밀듯 밀려오는 girl 오늘 밤 내가 댐 밑 관리부 오늘 밤 내가 댐 밑 관리부 오늘 밤 내가 댐 밑 관리부 오늘 밤 내가 댐 밑 관리부 팔당댐 saturday night 쉴 틈 없는 핸드폰 ringing 답장은 no no 도도하게 물밀듯 밀려오는 girls like 팔당댐 saturday night 쉴 틈 없는 핸드폰 ringing 답장은 no no 도도하게 물밀듯 밀려오는 girls like 팔당댐
20160229	백지영	사랑이 온다	female	댄스	16	박장근	Long Candy	트라이어스	난 널 처음 본 순간부터 알고 있었어 너도 알고 있었어 끌리는 건 어쩔 수 없더라고 흘깃 하고 날 보고 있었어 아니면 어쩔 수 없고 유리 같은 너 내 앞에선 강한 척 하지만 조심해야지 내가 작은 상처라도 주는 게 싫어 네 앞에서 조심하게 돼 자꾸만 커져가 기대가 무슨 아픔이 그리 많아 내가 다 들어 줄게 그러니 어서 나와 숨어있지마 있는 그대로의 너를 보여줘 난 그걸로 충분해 멈추지마 세상 사람 다 아는데 너만 모르는 것 같아 혼자서 그렇게 눈치가 없어 감추지마 지금 내 마음을 표현할 단어를 찾을 수 없어 있다면 돈을 줘서라도 사고 싶어 Can you feel me 떨리니 손 끝에 남겨진 네가 들리니 내 마음이 한 순간 내 안의 네가 내게로 온다 온다 온다 사랑이 온다 온다 온다 뛴다 뛴다 뛴다 가슴이 뛴다 뛴다 뛴다 요즘 내 마음과 핸드폰은 너 때문에 항상 열려있어 무슨 편의점도 아니고 대체 언제 올지 모르는 전화를 왜 기다리는 건지 몰라 이걸 누가 아냐고 모르겠어 그냥 당기고만 싶어 이걸 이렇게라도 난 남기고만 싶어 네가 보낸 두 글자 아님 세 글자 그게 뭐라고 이렇게 가슴이 뛰나 싶어 만약에 말이야 네가 내 맘 훔쳐간 범인이라면 인정해야지 난 스톡홀롬 신드롬 굳이 설명하자면 이젠 난 너 없인 힘들어 원래 이렇게 헤매는 스타일이 아니라고 난 진지하게 물어볼게 솔직히 대답해줘 진짜 너 왜 날 자꾸 흔들어 Can you feel me 떨리니 손 끝에 남겨진 네가 들리니 내 마음이 한 순간 내 안의 네가 내게로 온다 온다 온다 사랑이 온다 온다 온다 뛴다 뛴다 뛴다 가슴이 뛴다 뛴다 뛴다 죽을 만큼 널 사랑한다 사랑하고 사랑해 너 하날 본다 죽을 만큼 널 사랑한다 사랑하고 사랑해 너 하날 본다 온다 온다 온다 사랑이 온다 온다 온다 뛴다 뛴다 뛴다 가슴이 뛴다 뛴다 뛴다
