년도	가수	제목	남녀	장르	최고순위	작사가	작곡가	소속사	가사
20190401	첸 (CHEN)	사월이 지나면 우리 헤어져요 (Beautiful goodbye)	male	발라드	3	Jisoo Park (153/Joombas)	MooF (153/Joombas)	(주)SM엔터테인먼트	우리 하지 못한 말들 마저 얘기해요 산들바람이 우릴 감싸줄 때 이렇게 마주 앉아 이별에 대해 말해보아요 이번 겨울이 지나고 꽃이 피고 나면 우리 이대로 다 괜찮을 거라 했었는데 아무리 노력을 해도 시들어가는 맘 견디기 힘들어 사월이 지나면 그땐 우리 아무 일도 없듯이 발길을 돌려요 그래야 마지막 우리 인사가 아름다울 수 있게 그때까진 조금만 더 웃어요 웃어요 다시 시간을 되돌려 처음 만난다면 가로등 옆에 서 있지 말아요 미소 짓지도 왼손으로 머릴 넘기지 마요 그래야 내가 그대를 지나칠 테니까 사월이 지나면 그땐 우리 아무 일도 없듯이 발길을 돌려요 그래야 마지막 우리 인사가 아름다울 수 있게 그때까진 조금만 더 웃어요 네 맘을 다독여봐도 변하는 이율 물어도 멀어져 그러니 이런 나보다 더 나은 사람을 만나 미소 짓기를 바래요 그대가 멀어진 만큼 시야가 흐려지네요 사랑했었기 때문에 우리 마지막 인사를 해요 이 시간이 가기 전에 행복해요 그걸 빌어요 기억해요 사랑했단 걸 우리 우리 우리 우리
20190401	IZ*ONE (아이즈원)	비올레타	female	댄스	25	김승수	김승수	오프더레코드	눈 감아도 느껴지는 향기 Oh 은은해서 빠져들어 저 멀리 사라진 그 빛을 따라 난 너에게 더 다가가 다가가 Ah ah 날 보는 네 눈빛과 날 비추는 빛깔이 모든 걸 멈추게 해 너를 더 빛나게 해 어느 순간 내게로 조용히 스며들어 같은 꿈을 꾸게 될 테니까 저 넓은 세상을 네 눈앞에 그려봐 네 진심을 느껴봐 네 안에 숨겨둔 널 세상에 펼쳐봐 있는 그대로 지금 느낌 그대로 내게 널 보여줘 넌 나의 비올레타 나에게 다 넌 나의 비올레타 모든 게 다 넌 나의 비올레타 너 너 너 나를 믿어줄래 어서 내게 더 더 더 네 맘을 열어줄래 신비로운 네 빛깔을 담아 너를 비춰줄 내 모습을 닮아 누구보다 빛이 날 수 있게 너와 나 함께 할 수 있게 아름답게 펼쳐진 네 향기로 채워진 세상에 맘을 열어 네게 더 귀 기울여 내 안에 너를 비춰 영원히 널 물들여 눈부시게 더 빛날 테니까 널 닮은 하늘에 숨겨왔던 마음을 기다렸던 순간을 늘 바라왔었던 널 하늘에 담아서 있는 그대로 지금 느낌 그대로 내게 널 보여줘 넌 나의 비올레타 나에게 다 넌 나의 비올레타 모든 게 다 언제든지 널 기다릴게 항상 난 곁에 있으니까 화려한 조명보다 더 널 향한 빛으로 더 오직 너를 위한 나니까 넌 나의 비올레타 나에게 다 넌 나의 비올레타 모든 게 다 저 하늘에 그려진 너의 미소가 밝게 빛이 나잖아 Oh 아름다운 네 맘의 Flower 넌 나의 비올레타 지켜줄게 널 환히 비춰 줄게 널 넌 나의 세상 넌 나의 빛 Oh my heart 비올레타
20190402	볼빨간사춘기	"나만, 봄"	female	"인디음악, 포크/블루스"	1	안지영	바닐라맨 (바닐라어쿠스틱)	쇼파르뮤직	안돼 그만둬 거기까지 해 더 다가가면 너 정신 못 차려 안돼 그만해 꽃은 넣어둬 그냥 좀 바람이 불게 놔줘 왜 그럴까 사람들은 그냥 봄기운이 좋아 눈치 없이 밖을 나가는 걸까 왜 이럴까 뭐가 설렌다고 봄바람이 좋아 내 맘도 모르고 더 불어와 flower sunshine 완벽한 하루를 사실 너와 걸을 수 있다면 얼마나 좋을까 좋아한다고 말하기가 무서워서 네 곁을 맴돌고 있는 난 벚꽃도 뭐고 다 필요 없어 나는 네 곁에 있고 싶어 딱 붙어서 봄이 지나갈 때까지 다른 사람 다 사라져라 나만 봄 왜 그럴까 사람들은 그냥 봄기운이 좋아 눈치 없이 밖을 나가는 걸까 왜 이럴까 뭐가 설렌다고 봄바람이 좋아 내 맘도 모르고 더 불어와 flower sunshine 완벽한 하루를 사실 너와 걸을 수 있다면 얼마나 좋을까 좋아한다고 말하기가 무서워서 네 곁을 맴돌고 있는 난 벚꽃도 뭐고 다 필요 없어 나는 네 곁에 있고 싶어 딱 붙어서 봄이 지나갈 때까지 다른 사람 다 사라져라 언제 봄이 왔는지 내 맘도 모르고 봄바람이 자꾸만 불어와 네 곁에 딱 붙어서 떨어지지 않고 싶어 내 맘을 이제 말하고 싶어 벚꽃도 뭐고 다 필요 없어 나는 네 곁에 있고 싶어 딱 붙어서 봄이 지나갈 때까지 다른 사람 다 사라져라 나만 봄
20190402	볼빨간사춘기	별 보러 갈래?	female	"인디음악, 포크/블루스"	5	안지영	바닐라맨 (바닐라어쿠스틱)	쇼파르뮤직	maybe it's like a dream I see the stars over me maybe it's like a magic I know you you you're my star saturday night 재미없는 얘기 no beer no cheers 우리 둘만 여기 재미없는 사람끼리 눈이 맞았나 봐 you've heard of my songs 어떤 별을 가장 좋아하냐며 미소를 띠고 내게 말해 별 보러 갈래 listen to our favorite songs 좋아하는 노랠 듣고 웃고 떠들다 보면 we drive away 어느새 멋진 바다 위로 별들이 쏟아져내려 can’t you see the stars they called it milky way 쏟아져 머리 위로 넌 나를 업고 모래사장을 뛰어다녀 yeah 그중 가장 예쁜 저 별을 찾아서 밤이 새도록 뛰어다니고 stars are over me maybe I know the name I see the stars over me maybe you got a planet I know you you got my star everyday night 매일 같은 얘기 no feeling no chilling 우리 둘만 여기 재미없는 사람끼리 눈이 맞았나 봐 you've heard of my songs 어떤 별을 가장 좋아하냐며 미소를 띠고 내게 말해 별 보러 갈래 listen to our favorite songs 좋아하는 노랠 듣고 웃고 떠들다 보면 we drive away 어느새 멋진 바다 위로 별들이 쏟아져내려 can’t you see the stars 모래 위에 누워서 저 별을 다 세보다가 아름다웠던 우리 이 순간을 저 별에 담아서 we fell in love see the star be your star yeah yeah they called it milky way 쏟아져 머리 위로 넌 나를 업고 모래사장을 뛰어다녀 yeah 그중 가장 예쁜 저 별을 찾아서 밤이 새도록 뛰어다니고 stars are over me
20190402	볼빨간사춘기	Mermaid	female	"인디음악, 포크/블루스"	26	안지영	안지영	쇼파르뮤직	너무 어둡고 캄캄한 내 맘은 네가 알기엔 먼 곳만 같아서 자꾸 난 도망치려 할 때마다 네 그 눈빛이 자꾸만 날 찾아 기억 속에 짓궂게도 네 모습은 습관처럼 고개를 숙이며 어떤 말을 해야 할지 모른 채로 아주 잠시 내 모습을 들여다봐 네가 사라지면 난 없어져 버릴지도 몰라 아주 조용한 바닷속으로 사라질지도 몰라 나는 너를 너무 사랑했었다고 믿겠지만 네가 사라지면 어떤 말도 할 수 없겠지만 아주 조용히 기억 속에 짓궂게도 네 모습은 습관처럼 고개를 숙이며 어떤 말을 해야 할지 모른 채로 아주 잠시 내 모습을 들여다봐 네가 사라지면 난 없어져 버릴지도 몰라 아주 조용한 바닷속으로 사라질지도 몰라 나는 너를 너무 사랑했었다고 믿겠지만 네가 사라지면 어떤 말도 할 수 없겠지만 아주 조용히 아주 조용히 아주 조용히 아주 조용히 겨울이 지나가고 봄이 다가올 때쯤 넌 물어보겠지 어디로 향하냐고 사실 나도 몰라 어디쯤 내가 있는지 그냥 네가 있는 그곳에 여전히 나 머물러 아주 조용히 아주 조용히 아주 조용히 네가 사라지면 난 없어져 버릴지도 몰라 아주 조용한 바닷속으로 사라질지도 몰라 아주 조용히 날 떠나려 하지 마 좋은 노랠 들려줄게 그냥 네 옆에서 널 바라만 볼게 아주 잠시 내가 널 잊어버렸는지 몰라 내 곁에 네 모습이 흐릿해진 줄 모르고 you always be my mermaid
20190405	BLACKPINK	Kill This Love	female	랩/힙합	21	Bekuh BOOM	Bekuh BOOM	(주)YG엔터테인먼트	천사 같은 Hi 끝엔 악마 같은 Bye 매번 미칠듯한 High 뒤엔 뱉어야 하는 Price 이건 답이 없는 Test 매번 속더라도 Yes 딱한 감정의 노예 얼어 죽을 사랑해 Here I come kick in the door 가장 독한 걸로 줘 뻔하디 뻔한 그 love 더 내놔봐 give me some more 알아서 매달려 벼랑 끝에 한마디면 또 like 헤벌레 해 그 따뜻한 떨림이 새빨간 설렘이 마치 heaven 같겠지만 you might not get in it Look at me Look at you 누가 더 아플까 You smart 누가 You are 두 눈에 피눈물 흐르게 된다면 So sorry 누가 You are 나 어떡해 나약한 날 견딜 수 없어 애써 두 눈을 가린 채 사랑의 숨통을 끊어야겠어 LET’S KILL THIS LOVE LET’S KILL THIS LOVE Feelin’ like a sinner Its so fire with him I go boo hoo He said you look crazy Thank you baby I owe it all to you Got me all messed up His love is my favorite But you plus me sadly can be dangerous Lucky me Lucky you 결국엔 거짓말 we lie So what so what 만약에 내가 널 지우게 된다면 So sorry I’m not sorry 나 어떡해 나약한 날 견딜 수 없어 애써 눈물을 감춘 채 사랑의 숨통을 끊어야겠어 LET’S KILL THIS LOVE LET’S KILL THIS LOVE We all commit to love That makes you cry We’re all making love That kills you inside We must kill this love Yeah it’s sad but true Gotta kill this love Before it kills you too Kill this love Yeah it’s sad but true Gotta kill this love Gotta kill let’s kill this love
20190412	방탄소년단	작은 것들을 위한 시 (Boy With Luv) (Feat. Halsey)	male	댄스	25	Halsey	Halsey	빅히트엔터테인먼트	모든 게 궁금해 How’s your day Oh tell me 뭐가 널 행복하게 하는지 Oh text me Your every picture 내 머리맡에 두고 싶어 oh bae Come be my teacher 네 모든 걸 다 가르쳐줘 Your 1 your 2 Listen my my baby 나는 저 하늘을 높이 날고 있어 그때 니가 내게 줬던 두 날개로 이제 여긴 너무 높아 난 내 눈에 널 맞추고 싶어 Yeah you makin’ me a boy with luv Oh my my my oh my my my I've waited all my life 네 전부를 함께하고 싶어 Oh my my my oh my my my Looking for something right 이제 조금은 나 알겠어 I want something stronger Than a moment than a moment love I have waited longer For a boy with For a boy with luv 널 알게 된 이후 ya 내 삶은 온통 너 ya 사소한 게 사소하지 않게 만들어버린 너라는 별 하나부터 열까지 모든 게 특별하지 너의 관심사 걸음걸이 말투와 사소한 작은 습관들까지 다 말하지 너무 작던 내가 영웅이 된 거라고 Oh nah 난 말하지 운명 따윈 처음부터 내 게 아니었다고 Oh nah 세계의 평화 No way 거대한 질서 No way 그저 널 지킬 거야 난 Boy with luv Listen my my baby 나는 저 하늘을 높이 날고 있어 그때 니가 내게 줬던 두 날개로 이제 여긴 너무 높아 난 내 눈에 널 맞추고 싶어 Yeah you makin’ me a boy with luv Oh my my my oh my my my You got me high so fast 네 전부를 함께하고 싶어 Oh my my my oh my my my You got me fly so fast 이제 조금은 나 알겠어 Love is nothing stronger Than a boy with luv Love is nothing stronger Than a boy with luv 툭 까놓고 말할게 나도 모르게 힘이 들어가기도 했어 높아버린 sky 커져버린 hall 때론 도망치게 해달라며 기도했어 But 너의 상처는 나의 상처 깨달았을 때 나 다짐했던 걸 니가 준 이카루스의 날개로 태양이 아닌 너에게로 Let me fly Oh my my my oh my my my I've waited all my life 네 전부를 함께하고 싶어 Oh my my my oh my my my Looking for something right 이제 조금은 나 알겠어 I want something stronger Than a moment than a moment love Love is nothing stronger Than a boy with luv
20190412	방탄소년단	소우주 (Mikrokosmos)	male	R&B/Soul	11	Michel “Lindgren” Schulz	Michel “Lindgren” Schulz	빅히트엔터테인먼트	반짝이는 별빛들 깜빡이는 불 켜진 건물 우린 빛나고 있네 각자의 방 각자의 별에서 어떤 빛은 야망 어떤 빛은 방황 사람들의 불빛들 모두 소중한 하나 어두운 밤 외로워 마 별처럼 다 우린 빛나 사라지지 마 큰 존재니까 Let us shine 어쩜 이 밤의 표정이 이토록 또 아름다운 건 저 별들도 불빛도 아닌 우리 때문일 거야 You got me 난 너를 보며 꿈을 꿔 I got you 칠흑 같던 밤들 속 서로가 본 서로의 빛 같은 말을 하고 있었던 거야 우린 가장 깊은 밤에 더 빛나는 별빛 가장 깊은 밤에 더 빛나는 별빛 밤이 깊을수록 더 빛나는 별빛 한 사람에 하나의 역사 한 사람에 하나의 별 70억 개의 빛으로 빛나는 70억 가지의 world 70억 가지의 삶 도시의 야경은 어쩌면 또 다른 도시의 밤 각자만의 꿈 Let us shine 넌 누구보다 밝게 빛나 One 어쩜 이 밤의 표정이 이토록 또 아름다운 건 저 어둠도 달빛도 아닌 우리 때문일 거야 You got me 난 너를 보며 꿈을 꿔 I got you 칠흑 같던 밤들 속 서로가 본 서로의 빛 같은 말을 하고 있었던 거야 우린 가장 깊은 밤에 더 빛나는 별빛 가장 깊은 밤에 더 빛나는 별빛 밤이 깊을수록 더 빛나는 별빛 도시의 불 이 도시의 별 어릴 적 올려본 밤하늘을 난 떠올려 사람이란 불 사람이란 별로 가득한 바로 이 곳에서 We shinin’ You got me 난 너를 보며 숨을 쉬어 I got you 칠흑 같던 밤들 속에 Shine dream smile Oh let us light up the night 우린 우리대로 빛나 Shine dream smile Oh let us light up the night 우리 그 자체로 빛나 Tonight Na na na na na na Na na na na na na na Na na na na na na Na na na na na na na na Na na na na na na Na na na na na na na Na na na na na na Na na na na na na na na
20190412	방탄소년단	Make It Right	male	랩/힙합	15	j-hope	j-hope	빅히트엔터테인먼트	내가 날 눈치챘던 순간 떠나야만 했어 난 찾아내야 했어 All day all night 사막과 바다들을 건너 넓고 넓은 세계를 헤매어 다녔어 Baby I I could make it better I could hold you tighter 그 먼 길 위에서 Oh you’re the light 초대받지 못한 환영받지 못한 나를 알아줬던 단 한 사람 끝도 보이지 않던 영원의 밤 내게 아침을 선물한 건 너야 이제 그 손 내가 잡아도 될까 Oh oh I can make it right All right All right Oh I can make it right All right All right Oh I can make it right 이 세상 속에 영웅이 된 나 나를 찾는 큰 환호와 내 손 트로피와 금빛 마이크 All day everywhere But 모든 게 너에게 닿기 위함인 걸 내 여정의 답인 걸 널 찾기 위해 노래해 Baby to you 전보다 조금 더 커진 키에 좀 더 단단해진 목소리에 모든 건 네게 돌아가기 위해 이제 너라는 지도를 활짝 펼칠게 My rehab 날 봐 왜 못 알아봐 남들의 아우성 따위 나 듣고 싶지 않아 너의 향기는 여전히 나를 꿰뚫어 무너뜨려 되돌아가자 그때로 Baby I know I can make it better I can hold you tighter 그 모든 길은 널 향한 거야 다 소용없었어 너 아닌 다른 건 그때처럼 날 어루만져줘 끝도 보이지 않던 영원의 밤 내게 아침을 선물한 건 너야 이제 그 손 내가 잡아도 될까 Oh oh I can make it right All right All right Oh I can make it right All right All right Oh I can make it right 여전히 아름다운 너 그날의 그때처럼 말없이 그냥 날 안아줘 지옥에서 내가 살아 남은 건 날 위했던 게 아닌 되려 너를 위한 거란 걸 안다면 주저 말고 please save my life 너 없이 헤쳐왔던 사막 위는 목말라 그러니 어서 빨리 날 잡아줘 너 없는 바다는 결국 사막과 같을 거란 걸 알아 All right I can make it better I can hold you tighter Oh I can make it right 다 소용없었어 너 아닌 다른 건 Oh I can make it right All right All right Oh I can make it right
20190412	방탄소년단	HOME	male	랩/힙합	20	ADORA	ADORA	빅히트엔터테인먼트	미칠듯한 설레임에 인사조차 못했어 Yeah I'm going out baby 온 세상이 내 집 Crazy for myself 저 문을 열면 뭐든 다 될 것처럼 마치 무슨 본때를 보여줄 것처럼 집을 나섰지 이 모든 상상이 다 신기루로 끝나지 않길 Oh yeah I did it me shine with flashin’ lights Got lotta friends 고즈넉한 내 공간 그래 기억해 뭐든 다 할 수 있을 것만 같던 때 I saw the ocean yeah 이 문을 열기도 전에 Oh yeah 뭔가 채울수록 더 비어가 함께일수록 더 혼자인 것 같아 반쯤 감긴 눈 잠 못 드는 밤 니가 있는 곳 아마 그곳이 Mi Casa With you I’mma feel rich 바로 그곳이 Mi Casa 미리 켜둬 너의 switch Yeah 말을 안 해도 편안할 거야 너만 있다면 다 내 집이 될 거야 You know I want that Home You know you got that Home Your love your love your love I miss that Your love your love your love I want that Your touch your touch your touch I need that La la la la la la la la I love it 불 꺼진 현관에 내 발이 이상해 눈 감고 이불 안에 있어도 이상해 둥 붕 뜬 기분 빙 도는 두 눈 이 멋진 공간에 나 완전 초라해 완전 초라해 세상은 우리가 세상을 다 가진 줄 아는군 꿈에 그리던 Big house big cars big rings 내가 원한 건 모든 걸 가져도 뭔가 허전한 지금 모든 걸 이룬 자가 느낀 낯선 기분 But 지금 떠나도 돌아올 곳이 있기에 나서는 문 갈림길에서 자꾸 생각나 볼품없던 날 알아줬던 너 니 생각에 웃을 수 있었어 니가 있는 곳 아마 그곳이 Mi Casa With you I’mma feel rich 바로 그곳이 Mi Casa 미리 켜둬 너의 switch Yeah 말을 안 해도 편안할 거야 너만 있다면 다 내 집이 될 거야 You know I want that Home You know you got that Home 그 언젠가 초인종이 세 번 울리면 문을 열어주겠니 미처 못한 인사를 전할 수 있게 그땐 말할게 오랜만이야 Mi Casa With you I just feel rich 다녀왔어 Hi Mi Casa 켜뒀구나 너의 switch Yeah 말을 안 해도 편안하잖아 니가 있어서 나의 집이 된 거야 You know I want that Home You know you got that Home Your love your love your love I miss that Your love your love your love I want that Your touch your touch your touch I need that La la la la la la la la I love it
20190412	방탄소년단	Jamais Vu	male	R&B/Soul	22	방시혁	방시혁	빅히트엔터테인먼트	또 져버린 것 같아 넌 화가 나 보여 아른대는 Game over over over 만약 게임이라면 또 load하면 되겠지만 I guess I gotta deal with this deal with this Real world 차라리 게임이면 좋겠지 너무 아프니까 I need to heal my medic But I’m another star 완벽하지 못했던 나를 탓해 Brake in my head brake in my step always 그저 잘하고 싶었고 웃게 해주고 싶었는데 damn Please give me a remedy 멈춰버린 심장을 뛰게 할 remedy 이제 어떻게 해야 해 날 살려줘 다시 기회를 줘 Please give me a A remedy a melody 오직 내게만 남겨질 그 memory 이쯤에서 그만하면 꺼버리면 모든 게 다 편해질까 괜찮지만 괜찮지 않아 익숙하다고 혼잣말했지만 늘 처음인 것처럼 아파 부족한 gamer 맞아 날 control 못하지 계속 아파 ‘Cause 시행착오와 오만 가지 내 노래 가사 몸짓 하나 말 한마디 다 내 미시감에 무서워지고 또 늘 도망가려 해 But 잡네 그래도 네가 내 그림자는 커져가도 내 삶과 넌 equal sign So 내 remedy는 your remedy Please give me a remedy 멈춰버린 심장을 뛰게 할 remedy 이제 어떻게 해야 해 날 살려줘 다시 기회를 줘 Please give me a Remedy 또 다시 뛰고 또 넘어지고 Honestly 수없이 반복된대도 난 또 뛸 거라고 So give me a remedy 멈춰버린 심장을 뛰게 할 remedy 이제 어떻게 해야 해 날 살려줘 다시 기회를 줘 Please give me a remedy 성공인가 돌아왔어 멈춰버린 심장을 뛰게 할 remedy 집중해서 꼭 네게 닿고 말겠어 떨어지고 넘어지고 이제 어떻게 해야 해 익숙한 아픔이 똑같이 날 덮쳐 날 살려줘 이번에도 쉽지 않아 다시 기회를 줘 관둘 거냐고 No no never I won’t give up
20190412	방탄소년단	Dionysus	male	랩/힙합	29	Roman Campolo	Roman Campolo	빅히트엔터테인먼트	쭉 들이켜 술잔 sippin’ 팔짱 tippin’ 한 입 티르소스 grippin’ 포도 eatin’ 쭉 들이켜 분위기 keep it D style rip it 한 입 여기 kill it let’s steal it The illest 그냥 취해 마치 디오니소스 한 손에 술잔 다른 손에 든 티르소스 투명한 크리스탈 잔 속 찰랑이는 예술 예술도 술이지 뭐 마시면 취해 fool You dunno you dunno you dunno what to do with 내가 보여줄게 난 전혀 다른 걸 추진 아이비와 거친 나무로 된 mic 절대 단 한 숨에 나오는 소리 따윈 없다 해가 뜰 때까지 where the party at 잠이 들 때까지 where the party at Sing it 불러 다시 Drink it 마셔 다시 우린 두 번 태어나지 쭉 들이켜 창작의 고통 한 입 시대의 호통 쭉 들이켜 나와의 소통 한 입 Okay now I’m ready fo sho 다 마셔 마셔 마셔 마셔 내 술잔 ay 다 빠져 빠져 빠져 미친 예술가에 한 잔 one shot 두 잔 two shots 예술에 취해 불러 옹헤야 다 마셔 마셔 마셔 마셔 내 술잔 ay 다 빠져 빠져 빠져 미친 예술가에 한 잔 one shot 두 잔 two shots 꽹과리 치며 불러 옹헤야 술잔 sippin’ 팔짱 tippin’ 티르소스 grippin’ 포도 eatin’ 분위기 keep it D style rip it 여기 kill it let’s steal it The illest 난 지금 세상의 문 앞에 있어 무대에 오를 때 들리는 환호성 Can't you see my stacked broken thyrsus 이제 난 다시 태어나네 비로소 When the night comes mumble mumble mumble When the night comes tumble tumble tumble Studio를 채운 저음 저음 저음 Bass drum goes like 덤덤덤 해가 뜰 때까지 where the party at 잠이 들 때까지 where the party at Sing it 불러 다시 Drink it 마셔 다시 우린 두 번 태어나지 쭉 들이켜 창작의 고통 한 입 시대의 호통 쭉 들이켜 나와의 소통 한 입 Okay now I’m ready fo sho 다 마셔 마셔 마셔 마셔 내 술잔 ay 다 빠져 빠져 빠져 미친 예술가에 한 잔 one shot 두 잔 two shots 예술에 취해 불러 옹헤야 다 마셔 마셔 마셔 마셔 내 술잔 ay 다 빠져 빠져 빠져 미친 예술가에 한 잔 one shot 두 잔 two shots 꽹과리 치며 불러 옹헤야 우리가 떴다 하면 전세계 어디든지 stadium party ay Kpop 아이돌로 태어나 다시 환생한 artist 다시 환생한 artist 다시 환생한 artist 내가 아이돌이든 예술가이든 뭐가 중요해 짠해 예술도 이 정도면 과음이지 과음 yeah 새 기록은 자신과 싸움이지 싸움 yeah 축배를 들어올리고 one shot 허나 난 여전히 목말라 What 다 마셔 마셔 마셔 마셔 내 술잔 ay 다 빠져 빠져 빠져 미친 예술가에 한 잔 one shot 두 잔 two shots 예술에 취해 불러 옹헤야 다 마셔 마셔 마셔 마셔 내 술잔 ay 다 빠져 빠져 빠져 미친 예술가에 한 잔 one shot 두 잔 two shots 꽹과리 치며 불러 옹헤야 술잔 sippin’ 팔짱 tippin’ 티르소스 grippin’ 포도 eatin’ 분위기 keep it D style rip it 여기 kill it let’s steal it The illest 술잔 sippin’ 팔짱 tippin’ 티르소스 grippin’ 포도 eatin’ 분위기 keep it D style rip it 여기 kill it let’s steal it The illest
