년도	가수	제목	남녀	장르	최고순위	작사가	작곡가	소속사	가사
20170201	Zion.T	노래	male	R&B/Soul	2	Zion.T	KUSH (쿠시)	THE BLACK LABEL	이 노래는 유명해지지 않았으면 해 이 노래는 유명해지지 않았으면 해 사람들이 가사를 못 외웠으면 해 에베베베 에베베베 일주일 전 욕조에서 나 혼자 흥얼거리던 노래 이제는 너 혼자 듣고 있고 곧 사람들도 듣게 되겠지 피아노 하나로는 심심해 베이스도 넣게 되었지 하루 종일 널 생각하다 쓴 노래 별 내용은 없지만 그냥 내 마음이다 생각하고 들어줬으면 이 노래는 유명해지지 않았으면 해 이 노래는 유명해지지 않았으면 해 사람들이 가사를 못 외웠으면 해 에베베베 에베베베 다른 내 노래들처럼 오 유명해지지 않았으면 해 유명한 어떤 곡들처럼 금방 잊혀지지 않기를 하루 종일 붙어 다니자 길 고양이들처럼 너는 매일 설레야 돼 처음 만난 것처럼 난 저 다른 놈들처럼 가방 귀걸이 목걸이 반지 그딴 건 뻔해서 이 노래를 선물하지 워 잘 맞아 우린 난리 났지 워 안 닳아 내 마음 계속 새것 같지 하루를 마치고 자기 전에 자장가 대신 틀어줬으면 해 성급해 보일까 걱정돼 주머니 속에 꼭꼭 숨겨놓았던 이 노래는 유명해지지 않았으면 해 이 노래는 유명해지지 않았으면 해 사람들이 가사를 못 외웠으면 해 에베베베 에베베베 Clap your hands ya'll Clap your hands for her Clap your hands for her Clap your hands for her Clap your hands for her Clap your hands ya'll It's your song It's your song It's your song It's your song your song your song It's your song your song your song It's your song It's your song
20170201	Zion.T	Complex (feat. G-DRAGON)	male	R&B/Soul	3	진용	Slom	THE BLACK LABEL	살이 좀 쪘으면 좋겠어 넌 내 마른 몸을 좋아하지만 안아줄 때 같이 잘 때 너 팔베개 깔아줄 때 너의 목 건강을 위해 내 키가 좀만 컸으면 좋겠어 네가 만나던 키 큰 애들보다 그리고 손도 조금만 더 컸음 해 어 근데 그 그건 더 안 커도 될 것 같아 너무 빡세 하루하루 하루하루 개인 정보 직업란 가수 엄마 노래는 어떻게 해야 돼 니네 안 살아봤으면 말을 말아 왜 이리 일이 많아 전화 좀 그만했으면 좋겠어 특히 너네 양화대교 지나갈 때 그래그래 그 노래 좋아해 근데 그 다리가 뭔 상관인데 Complex My complex My complex I'm COMPLEX than the magazine I hate me more than you hate me I'm complex than the magazine 내가 아이돌이었음 좋겠어 춤 잘 추고 잘생긴 놈 dance 사랑 노래만 쓰면 되니까 노래 못하면 벗으면 되니까 'Yeah oh yeah oh yeah Oh yeah oh yeah 사랑해 미치겠어 handsome oh yeah oh yeah' 이러면 되니까 해솔아 형은 콤플렉스가 없어 미안 키작고 말라도 괜찮아 뭐 나니까 오히려 난 말이야 if i was zion.T 노래는 다 아는데 얼굴은 잘 모르니까 GD라하면 돈 FAME 여자 그래 솔직히 다 셀 수 없어 그렇다고 재수없어 나처럼 살아봐 Think you can walk in my shoes Look at me now 내가 네 콤플렉스다 임마 99 complexes but you can't be me 99 complexes but you can't be me 콤플렉스 문제를 삼으면 문제가 돼 I got no complex yea that's me My complex My complex My complex I'm COMPLEX than the magazine I hate me more than you hate me I'm complex than the magazine Complex My complex My complex I'm COMPLEX than the magazine I hate me more than you hate me I'm complex than the magazine 가끔 나 내가 아님 좋겠어 아무도 우리가 우리인지 모른다면 남들처럼 손 잡고 걷는 상상해 햇살 좋은 공원에서
20170201	Zion.T	미안해 (feat. Beenzino)	male	R&B/Soul	7	빈지노 (Beenzino)	서원진	THE BLACK LABEL	몇 시간 째 뚜뚜뚜 받지 않네요 큰일 났어 oh no 내 마음 같지 않네요 아까는 내가 진짜 잘못했어 전화해 Call me baby 아마도 그댄 그댄 방에 누워있겠죠 아니면 어디 시끄러운 곳에서 내 욕하고 있겠죠 괜찮아 아 자기야 제발 제발 이해해줘 미안해 미안하다는 말이 더 싫겠지만 미안해 도대체 뭐가 미안하냐 묻겠지만 미안해 I'm sorry uh 그녀는 복잡해 난 칠판 앞의 문제아 같아 답이 안 나와 나 수학 못 해 유부남인 친구 형들에게 물어봐도 빨리 사과해 남자가 그러면 안 돼 I'm trying to work work baby I'm sorry 다른 말 뭐가 더 필요한지 당연히 말을 안 함 모르지 미안해 mi amor woaini liebe dich 알아먹어 줘 내 사랑을 사랑과 전쟁에서 I don't want war 너가 지금 내게 내리는 형벌도 달게 받을게 다만 잘해줬던 때도 참작해서 내게 판결을 내려줘요 너의 화를 막으려고 돈을 써서 이유 막론 싸울 때 욕을 써서 그 싸움에서 영감 받아 곡을 써서 내가 미안해요 자꾸 말끝마다 꼬리를 붙여서 넘어갈 것도 까치발 들고 덤벼 그럴 수 있는 사랑에 너무 논리 정연해서 꼭 화를 부르네요 미안하다는 말이 더 싫겠지만 미안해 도대체 뭐가 미안하냐 묻겠지만 미안해 I'm sorry uh 그녀는 복잡해 난 칠판 앞의 문제아 같아 답이 안 나와 나 수학 못해 유부남인 친구 형들에게 물어봐도 빨리 사과해 남자가 그러면 안 돼 Babe Sorry sorry 나의 유일한 변명 I'm sorry I love you Forgive me 나의 유일한 변명은
20170201	Red Velvet (레드벨벳)	Rookie	female	댄스	16	조윤경	Tay Jasper	(주)SM엔터테인먼트	Yeah alright 1 2 당당히 넌 고개를 들고 나를 봐 역시 Rookie rookie my super rookie rookie boy 좋아 볼 때마다 진짜 넌 내 Type 역시 Rookie rookie my super rookie rookie boy ha 이토록 거센 존재감 난 이미 혹시나 하는 작은 의심조차 못 해 즐기는 척 하하 난 웃어 봐 애써 말투까지 네 앞에선 마치 Ice같지 불쑥 들어와 넌 벌써 날 벌써 날 위태롭게 더 홀려 놔 홀려 놔 낯선 너의 번호까지 한번에 난 외워버린 거야 Why 자꾸만 왜 날 왜 날 흔들까 넌 바짝 다가와 그래 옳지 옳지 Boy ha Rookie rookie my super rookie rookie rookie 맞지 맞지 그 느낌적인 느낌 느낌 Rookie rookie my super rookie rookie rookie 맞지 맞지 그 느낌적인 느낌 느낌 역시 넌 Nice하게 더 다가오잖아 멋진 Rookie rookie my super rookie rookie boy 좋아질 때마다 짜릿한 My heart 멋진 Rookie rookie my super rookie rookie boy ha 딴 남자 볼 땐 웃지 좀 마 이미 넌 마치 남자친구처럼 슬쩍 화내지 아침엔 날 매일 데리러 와 Baby 날 뺏길까 봐 하루 종일 경계해 Baby yeah I like it 날카로워진 네 눈빛 아직까진 특별할 게 없는 우리 언제까지 기다리게 할 거니 좀 더 바짝 다가와 그래 옳지 옳지 Boy ha 불쑥 들어와 넌 벌써 날 벌써 날 위태롭게 더 홀려 놔 홀려 놔 낯선 너의 번호까지 한번에 난 외워버린 거야 Why 자꾸만 왜 날 왜 날 흔들까 넌 바짝 다가와 그래 옳지 옳지 Boy ha Rookie rookie my super rookie rookie rookie 맞지 맞지 그 느낌적인 느낌 느낌 Rookie rookie my super rookie rookie rookie 맞지 맞지 그 느낌적인 느낌 느낌 괜히 겁이 나 내 맘 뺏긴 만큼 차가워진 척해 넌 불안해하지만 Uh 감추려 해도 이미 넌 내 마음속의 별이야 자꾸 더 반짝여 이젠 네 모든 게 Yeah Rookie rookie 넌 나의 rookie rookie rookie Rookie rookie 넌 나의 rookie rookie rookie Rookie rookie 넌 나의 rookie rookie rookie Rookie rookie 넌 나의 rookie rookie rookie Rookie rookie my super rookie rookie rookie 맞지 맞지 그 느낌적인 느낌 느낌 Rookie rookie my super rookie rookie rookie 맞지 맞지 그 느낌적인 느낌 느낌
20170201	Zion.T	영화관	male	R&B/Soul	23	Zion.T	PEEJAY	THE BLACK LABEL	15분 전 나란히 앉아서 아니 마주 앉아서 바라본 살색 스크린 You know what I mean 자세히 보니 눈동자는 푸른색 영화관 같아 그녀와 함께 있는 게 영화 보는 것 같아 내 눈을 자꾸 의심해 나는 너의 한 마디 한 마디 대사에 집중해 다음 이야기 궁금해 라라라라라 라라라 살색 스크린 You know what I mean 회색 차를 타는 너 난 조수석에 앉아 영화관 같아 그녀와 함께 있는 게 영화 보는 것 같아 내 눈을 자꾸 의심해 나는 너의 한 마디 한 마디 대사에 집중해 다음 이야기 궁금해 라라라라라 라라라 Umm she's blue Green Sometimes she's red Red 영화관에 그 모습이 머릿속에 나는 너의 한마디 대사에 집중해 다음 이야기 궁금해 라라라라 라라라 어떤 장면으로 남을까 너와 나의 이야기가 언젠가 사람들의 입에 오르내릴까 다음 주연배우는 누굴까 난 어쩌면 카메오 아닐까 자리에 앉아있을까
20170206	블락비 (Block B)	YESTERDAY	male	댄스	3	지코 (ZICO)	Megatone (13)	세븐시즌스	너 아닌 척하지마 눈에 보이지만 넘어가는 걸 What did you do yesterday 곰인 척하지마 여우인 걸 알지만 넘어가는 걸 What did you do yesterday What did you do yesterday What did you do do do do 일찍 잔다는 너 요새 피곤하다며 열한 시간 동안 잠수더니 또 피곤하대 무심코 내려놓은 듯한 폰은 오늘도 덮어놓고는 내가 예민하대 어디까지가 진실 어디까지가 거짓인지 어디 설명해봐 넌 얼굴색 하나 안 변하고 육하원칙으로 반론해 언제나 쏘아붙이면 대활 거부해 팩트를 들이대면 모르쇠 Yesterday all my trouble came close to me 또 나만 호구된 청문회 너 아닌 척하지마 눈에 보이지만 넘어가는 걸 What did you do yesterday 곰인 척하지마 여우인 걸 알지만 넘어가는 걸 What did you do yesterday 넌 너가 예쁜 걸 알아서 문제야 No no no no 은근슬쩍 시선 즐기는 너 불안하게 왜 그래 No no no no 프로필 사진은 왜 바꾼 거야 옷은 왜 어제랑 똑같은 거야 일부러 싫증 유발하는 거야 끝장내고 싶은 거야 뭐야 I Don’t Know Why I Love You eh 심증뿐인 추궁은 본전도 못 건졌네 넌 내 머리 위 난 네 발 밑 아쉬운 쪽이 손해 보는 싸움 너 아닌 척하지마 눈에 보이지만 넘어가는 걸 What did you do yesterday 곰인 척하지마 여우인 걸 알지만 넘어가는 걸 What did you do yesterday 라리라라라 라라라라라 돌고 도는 패턴이지만 라리라라라 라라라라라 넘어가는 걸 What did you do yesterday 알면서도 속아주는 거야 그만큼 널 좋아하는 거야 다만 들키지만 말아줘 그럼 다 눈감아줄게 뭐든지 해줄게 너 아닌 척하지마 눈에 보이지만 넘어가는 걸 What did you do yesterday 곰인 척하지마 여우인 걸 알지만 넘어가는 걸 What did you do yesterday 라리라라라 라라라라라 돌고 도는 패턴이지만 라리라라라 라라라라라 넘어가는 걸 What did you do yesterday
20170213	방탄소년단	봄날	male	랩/힙합	5	SUGA	SUGA	빅히트엔터테인먼트	보고 싶다 이렇게 말하니까 더 보고 싶다 너희 사진을 보고 있어도 보고 싶다 너무 야속한 시간 나는 우리가 밉다 이젠 얼굴 한번 보는 것 조차 힘들어진 우리가 여긴 온통 겨울 뿐이야 8월에도 겨울이 와 마음은 시간을 달려가네 홀로 남은 설국열차 니 손 잡고 지구 반대편까지 가 겨울을 끝내고파 그리움들이 얼마나 눈처럼 내려야 그 봄날이 올까 Friend 허공을 떠도는 작은 먼지처럼 작은 먼지처럼 날리는 눈이 나라면 조금 더 빨리 네게 닿을 수 있을 텐데 눈꽃이 떨어져요 또 조금씩 멀어져요 보고 싶다 보고 싶다 보고 싶다 보고 싶다 얼마나 기다려야 또 몇 밤을 더 새워야 널 보게 될까 널 보게 될까 만나게 될까 만나게 될까 추운 겨울 끝을 지나 다시 봄날이 올 때까지 꽃 피울 때까지 그곳에 좀 더 머물러줘 머물러줘 니가 변한 건지 니가 변한 건지 아니면 내가 변한 건지 내가 변한 건지 이 순간 흐르는 시간조차 미워 우리가 변한 거지 뭐 모두가 그런 거지 뭐 그래 밉다 니가 넌 떠났지만 단 하루도 너를 잊은 적이 없었지 난 솔직히 보고 싶은데 이만 너를 지울게 그게 널 원망하기보단 덜 아프니까 시린 널 불어내 본다 연기처럼 하얀 연기처럼 말로는 지운다 해도 사실 난 아직 널 보내지 못하는데 눈꽃이 떨어져요 또 조금씩 멀어져요 보고 싶다 보고 싶다 보고 싶다 보고 싶다 얼마나 기다려야 또 몇 밤을 더 새워야 널 보게 될까 널 보게 될까 만나게 될까 만나게 될까 You know it all You're my best friend 아침은 다시 올 거야 어떤 어둠도 어떤 계절도 영원할 순 없으니까 벚꽃이 피나봐요 이 겨울도 끝이 나요 보고 싶다 보고 싶다 보고 싶다 보고 싶다 조금만 기다리면 며칠 밤만 더 새우면 만나러 갈게 만나러 갈게 데리러 갈게 데리러 갈게 추운 겨울 끝을 지나 다시 봄날이 올 때까지 꽃 피울 때까지 그곳에 좀 더 머물러줘 머물러줘
20170217	DEAN	넘어와 (Feat. 백예린)	male	R&B/Soul	22	Deanfluenza	highhopes	"Joombas Co Ltd, 유니버설뮤직(가요)"	이런 야심한 밤 그런 걱정을 왜 해 물어볼 뿐이야 오해는 왜 해 TV 드라마로 끝내기엔 저 달이 너무 밝아서 So I just wanna talk about you and me yeah 밤하늘 위 잠긴 목소리로 차가워 진 폰을 밤새 달궈 oh no 별 말을 안 해도 훌쩍 지나있는 시간 속에 올라타있어 Am I crazy yeah maybe 뭘까 어딜까 막 이쁘진 않은데 자꾸만 눈이 가 날 못 살게 구는 게 나도 어지러워 도와줘 밖은 어두워져 Don't you want my love 시계 초 소리만 더 커져 거기 멈춰 넘어와 그쯤에서 하고 넘어와 oh baby 넘어와 이 밤을 건너 넘어와 oh baby 달처럼 마음도 기우네 할 말은 떨어지고 그 사이를 비집고 정적이 틈을 채우네 밤 새 오늘을 기다렸는데 네 앞에만 서면 난 왜 이리 작아지는지 Oh 왜 길거리 위를 끝없이 서성이며 차가워 진 손을 밤새 달궈 oh no 어제처럼 그제처럼 집에 돌아가기엔 I’m so crazy yeah maybe 뭘까 어딜까 막 이쁘진 않은데 자꾸만 눈이 가 날 못 살게 구는 게 나도 어지러워 도와줘 밖은 어두워져 Don't you want my love 시계 초 소리만 더 커져 너와 나 사이 결론은 없는데 널 보면 이렇게 전부 알 것 같은 게 나도 힘들어 날 도와줘 oh let me into your heart 시계 초 소리만 더 커져 바로 그 순간 넘어와 네가 내 쪽으로 넘어와 What should I do baby 넘어와 내 맘 속으로 넘어와
20170220	TWICE (트와이스)	KNOCK KNOCK	female	댄스	1	Mayu Wakisaka	Mayu Wakisaka	(주)JYP엔터테인먼트	열두시가 되면 닫혀요 조금만 서둘러 줄래요 Knock knock knock knock knock on my door Knock knock knock knock knock on my door 밤이 되면 내 맘속에 출입문이 열리죠 누군가 필요해 Someone else 자꾸자꾸 서성이네 몰래 몰래 훔쳐보네 Knock knock knock knock knock on my door Knock knock knock knock knock on my door 보나마나 또 playboy 떠보나마나 bad boy 확신이 필요해 Knock knock 내 맘이 열리게 두드려줘 세게 쿵 쿵 다시 한번 쿵 쿵 Baby knock knock knock knock knock on my door Knock knock knock knock knock 쉽게 열리지는 않을 거야 say that you’re mine 내일도 모레도 다시 와줘 준비하고 기다릴게 knock on my Baby knock knock knock knock knock on my door Knock knock knock knock knock 들어도 계속 듣고 싶은 걸 Knock on my door 필요 없어 gold key or get lucky 진심이면 everything’s gonna be okay 어떡해 벌써 왔나 봐 잠시만 기다려 줄래요 혼자 있을 때 훅 들어와 정신 없이 날 흔들어 놔 지금이 딱 널 위한 show time make it yours 댕 댕 울리면 매일 찾아와줄래 뱅뱅 돌다간 잠들어 버릴 걸요 Knock knock knock knock knock on my door Knock knock knock knock knock on my door Come in come in come in baby take my hands 내 맘이 열리게 두드려줘 세게 쿵 쿵 다시 한번 쿵 쿵 Baby knock knock knock knock knock on my door Knock knock knock knock knock 쉽게 열리지는 않을 거야 say that you’re mine 내일도 모레도 다시 와줘 준비하고 기다릴게 knock knock Baby knock knock knock knock knock on my door Knock knock knock knock knock 들어도 계속 듣고 싶은 걸 Knock on my door Hey hey 이 시간이 지나면 굳어있던 내 맘이 내 내 맘이 아이스크림처럼 녹아 버릴 테니까 Come knock on my door 내 맘이 열리게 두드려줘 세게 쿵 쿵 다시 한번 쿵 쿵 Baby knock knock knock knock knock on my door Knock knock knock knock knock 쉽게 열리지는 않을 거야 say that you’re mine 내일도 모레도 다시 와줘 준비하고 기다릴게 knock knock Baby knock knock knock knock knock on my door Knock knock knock knock knock 들어도 계속 듣고 싶은 걸 Knock on my door Knock knock knock knock on my door I’m freakin’ freakin’ out freakin’ out out knock knock Knock knock knock knock on my door Knock knock knock knock knock on my door Knock knock knock knock knock on my door
20170228	태연 (TAEYEON)	Fine	female	발라드	2	진리 (Full8loom)	MZMC	(주)SM엔터테인먼트	찢어진 종잇조각에 담아낸 나의 진심에 선명해져 somethin' bout you Yeah 나를 많이 닮은 듯 다른 넌 혹시 나와 같을까 지금 괜한 기대를 해 하루 한 달 일 년쯤 되면 서로 다른 일상을 살아가 나는 아니야 쉽지 않을 것 같아 여전하게도 넌 내 하루하루를 채우고 아직은 아니야 바보처럼 되뇌는 나 입가에 맴도는 말을 삼킬 수 없어 It’s not fine Ah- Ah- Ah- Ah- It’s not fine 머릴 질끈 묶은 채 어지러운 방을 정리해 찾고 있어 somethin' new 가끔 이렇게 감당할 수 없는 뭐라도 해야 할 것만 같은 기분에 괜히 움직이곤 해 하루 한 달 일 년 그 쯤이면 웃으며 추억할 거라 했지만 나는 아니야 쉽지 않을 것 같아 여전하게도 넌 내 하루하루를 채우고 아직은 아니야 바보처럼 되뇌는 나 입가에 맴도는 말을 삼킬 수 없어 It’s not fine Ah- Ah- Ah- Ah- It’s not fine 의미 없는 농담 주고받는 대화 사람들 틈에 난 아무렇지 않아 보여 무딘 척 웃음을 지어 보이며 너란 그늘을 애써 외면해보지만 우리 마지막 그 순간이 자꾸 떠올라 잘 지내란 말이 전부였던 담담한 이별 아직은 아니야 바보처럼 되뇌는 그 말 입가에 맴도는 말을 삼킬 수 없어 It’s not fine Ah- Ah- Ah- It’s not fine Ah- Ah- Ah- It’s not fine
20170306	비투비	MOVIE	male	댄스	15	프니엘 (PENIEL)	일 (IL)	큐브엔터테인먼트	처음엔 다 그래 믿을만한 놈은 없고 네 옆에 내가 있기엔 너무 아깝다고 날 어떻게 말해도 넌 그냥 이대로 밤이 새도록 끝까지 나와 즐기면 돼 Hey DJ 여자는 자나 깨나 조심해야 해 둘로 나눠서 가질 순 없을 테니 Man 불이야 불이야 조심해 어두운 거리에서 나를 유혹하려 해도 I belong to my lady 유머 한 조각 올려 먹는 Cake 최고 외에 잡다한 수식어는 Pass Make history or not 널 향해 서 있어 All night alright 조금 어지러워 날 좀 붙잡아줘 가슴만은 따뜻해 난 거짓말은 잘 못 해 사실은 나 많이 외로운 것 같아 들어줘 Please don't leave me baby Love is like a movie 모두 뻔해 나도 그렇게 널 사랑하길 원해 늘 새롭게 남자답게 내 모든 걸 가져도 돼 내 시간은 너에게로 흘러 늦기 전에 나를 받아줘 네 마음에 상처 아무는 대로 I'll be your man 누구보다도 내 마지막 사랑이 되도록 Before it's too late girl you better stop fronting I'm one in a million limited edition No kidding you'll be wishing you could be my Mrs. Sooner or later girl you'll want that position When I walk up in the club all the girls stare at me I'm the only thing they see and the guys wish they were me Cuz I'm fresh and clean from my head to my feet I'm the definition of the word masterpiece 넌 나 흥분시키는데 뭐 있어 야릇해지고 붕붕 떠 있는 기분 그냥 얘길 해도 내 귀가 간지러 누가 내 안에다 너같이 위험한 다이너마이트를 심었나 이건 폭발 직전의 폭풍전야 끊어지는 이성과 터지는 심장이 Bomb bomb 뻔한 엔딩은 Bye bye like 연애혁명 공주와 왕자 Love is like a movie 모두 뻔해 나도 그렇게 널 사랑하길 원해 늘 새롭게 남자답게 내 모든 걸 가져도 돼 내 시간은 너에게로 흘러 늦기 전에 나를 받아줘 네 마음에 상처 아무는 대로 I'll be your man 누구보다도 내 마지막 사랑이 되도록 우리 둘의 만남은 어디까지일까 난 똑같은 실수는 다시 하지 않아 Move your body right now 날 두고 가지 마 Do it again do it again do it again yeah Love is like a movie 모두 뻔해 나도 그렇게 널 사랑하길 원해 늘 새롭게 남자답게 내 모든 걸 가져도 돼 내 시간은 너에게로 흘러 늦기 전에 나를 받아줘 네 마음에 상처 아무는 대로 I'll be your man 누구보다도 내 마지막 사랑이 되도록
20170306	여자친구 (GFRIEND)	FINGERTIP	female	댄스	17	용배 (RBW)	용배 (RBW)	(주)쏘스뮤직	오늘 난 특별해 설레는 시작이야 왠지 알 수 없는 두근거림에 끌려 사뿐한 발걸음 오늘따라 괜찮은 느낌이라 좋아 예감이 다 좋아 어떻게 방심한 순간 oh 이건 말도 안돼 그렇게 날 보는 눈빛이 너무 완벽해 아무 흠이 없는 너를 가리킨 순간 내 것이 될 것 같아 탕탕탕 FINGERTIP 네 맘을 겨눌게 탕탕탕 FINGERTIP 심장이 멈추게 뭐 어때 네 곁에 더 다가가볼게 손 끝에 네가 있어 FINGER FINGERTIP FINGER FINGERTIP 그래 너의 맘을 갖겠어 지금이야 시작해 완벽해 준비는 이미 끝났어 그 짧은 시간에 내 맘에 들어왔어 너 빼고 아무도 보이지도 않았어 한 걸음 다가가 너를 스치는 순간 느낌이 다 좋아 확실히 다가가 123 시간이 갈수록 열리는 fantasy 321 이 넓은 공간에 가득 가득해 아무 빈틈없는 너를 가리킨 순간 내 것이 될 것 같아 탕탕탕 FINGERTIP 네 맘을 겨눌게 탕탕탕 FINGERTIP 심장이 멈추게 뭐 어때 네 곁에 더 다가가볼게 손 끝에 네가 있어 FINGER FINGERTIP 오랫동안 기다린 순간에도 태연하게 그 누구도 모르게 눈치채지도 못하게 손짓하나 까딱까딱 네 맘을 조종할게 시간이 째깍째깍 다 가기 전에 다가와 1234 정말 어쩌지 널 조준했던 순간 사랑에 빠질 것 같아 탕탕탕 FINGERTIP 네 맘을 겨눌게 탕탕탕 FINGERTIP 심장이 멈추게 뭐 어때 네 곁에 더 다가가볼게 손 끝에 네가 있어 FINGER FINGERTIP FINGER FINGERTIP 그래 너의 맘을 갖겠어 지금이야 손 끝에 네가 있어 FINGER FINGERTIP
20170306	비투비	언젠가 (SOMEDAY)	male	발라드	30	정일훈	임현식 (비투비)	큐브엔터테인먼트	날 만지던 너의 그 두 손이 날 부르던 너의 목소리가 아직도 선명해 여전히 맴돌아 왜 네가 있을 때 최선을 다하지 못했을까 더 강했더라면 끝까지 널 붙잡았을 텐데 별생각 없이 잘 지내고 있다가도 잊혀진 기억은 찾아와 딜레마로 네가 있는 나와 네가 없는 나는 전혀 다른 두 사람이란 것만 알아둬 온갖 망상에 더 짙어지는 매캐한 공기 First time first love 처음치고는 꽤 좋았지 전쟁 통에 엉망진창이 됐어 어느새 But someday 언젠가 다시 만나 우리 더 좋은 날에 우리 좀 더 행복하게 좀 더 시원하게 파도 치는 바다 같을 때 꼭 다시 만나 우리 난 기다릴게 우리를 좀 더 행복하게 좀 더 차분하게 설레이는 햇빛 아래서 언젠가 널 떠나 보내던 날에 아주 어리석었었던 탓에 다 너를 탓하고 원망하고 미워했어 찢기듯 아프고 아파서 널 지워냈어 이제 와 돌이킬 수 없단 걸 모르는 바보라서 어린 날의 내가 아닌 더 강해지는 날에 그때 다시 한번 네 손 잡는다면 부디 언젠가 다시 만나 우리 더 좋은 날에 우리 좀 더 행복하게 좀 더 시원하게 파도 치는 바다 같을 때 꼭 다시 만나 우리 난 기다릴게 우리를 좀 더 행복하게 좀 더 차분하게 설레이는 햇빛 아래서 언젠가 솔직히 말할게 나 정말 후회해 미안하다는 한마디만 하면 됐는데 솔직히 말할게 내 탓인 거 인정해 나 때문에 우리가 서로 갈라져 버린 게 이제는 말할게 나 정말 미안해 우리가 서로 다시 볼 수 있게 매일 기도해 I pray for you every night and day hoping to see you face to face again someday 언젠가 다시 만나 우리 더 좋은 날에 우리 좀 더 행복하게 좀 더 시원하게 파도 치는 바다 같을 때 꼭 다시 만나 우리 난 기다릴게 우리를 좀 더 행복하게 좀 더 차분하게 설레이는 햇빛 아래서 언젠가
